{
  "library": "SM3_Dynamics",
  "title": "GetLibVersion (Function)",
  "url": "https://content.helpme-codesys.com/en/libs/SM3_Dynamics/Current/Library-Information/GetLibVersion.html",
  "page_title": "GetLibVersion (FUN)",
  "text": "Library Information\nGetLibVersion (Function)\nGetLibVersionNumber (Function)\nIsLibReleased (Function)\nSM3_Dynamics\nISMDynamics\nDynLoad (Struct)\nDynSpatialInertia (Struct)\nDynUnits (Struct)\nDynamicsParams (Struct)\nISMDynamics (Interface)\nAxesStateToTorque (Method)\nFile and Project Information\nLibrary Reference\nSM3_Error\nLibrary Identification\nLibrary Properties\nSM3_Math\nLibrary Identification\nLibrary Properties\nSM3_RBase\nLibrary Identification\nLibrary Properties\nSM3_Dynamics\nDocs\n»\nLibrary\nInformation\n»\nGetLibVersion (FUN)\nGetLibVersion (FUN)\nÂ¶\nFUNCTION GetLibVersion : VERSION\nThis function has been automatically generated from the project information.\nInOut:\nScope\nName\nType\nReturn\nGetLibVersion\nVERSION",
  "tables": [
    {
      "headers": [
        "Scope",
        "Name",
        "Type"
      ],
      "rows": [
        {
          "Scope": "Return",
          "Name": "GetLibVersion",
          "Type": "VERSION"
        }
      ]
    }
  ]
}