{
  "library": "SM3_Robotics",
  "title": "MC_TRANSITION_MODE (Enum)",
  "url": "https://content.helpme-codesys.com/en/libs/SM3_Robotics/Current/SM3_Robotics/Basic-types/MC_TRANSITION_MODE.html",
  "page_title": "MC_TRANSITION_MODE (ENUM)",
  "text": "Library Information\nGetLibVersion (Function)\nGetLibVersionNumber (Function)\nGetVersion (Function)\nIsLibReleased (Function)\nSM3_Robotics\nBasic types\nIDENT_IN_GROUP_REF_SM3 (Alias)\nMC_CIRC_PATHCHOICE (Enum)\nMC_COORD_REF (Struct)\nMC_EXECUTION_MODE (Enum)\nMC_TRANSITION_MODE (Enum)\nSMC_AXIS_GROUP_COMPATIBILITY_OPTIONS (Struct)\nSMC_AXIS_GROUP_CONTINUE_DATA (FunctionBlock)\nSMC_AXIS_GROUP_STATE (Enum)\nSMC_CIRC_MODE (Enum)\nSMC_DYN_LIMITS (Alias)\nSMC_IDynamicCS (Interface)\nSMC_ORIENTATION_MODE (Enum)\nSMC_POS_REF (Union)\nSMC_PTP_MOVEMENT_TYPE (Enum)\nSMC_READ_TOOL_MODE (Enum)\nPOUs\nAdditional\nSMC_AxisDistanceAxes (Enum)\nSMC_AxisDistanceSubMode (Enum)\nSMC_AxisDistanceTransition (FunctionBlock)\nSMC_AxisDistanceTransitionParam (Function)\nSMC_CornerDistance (FunctionBlock)\nSMC_CornerDistanceTransitionParam (Function)\nSMC_StartVelocity (FunctionBlock)\nSMC_StartVelocityAxes (Enum)\nSMC_StartVelocityTransitionParam (Function)\nSMC_StartupAxisGroup (FunctionBlock)\nAdministrative/Configuration\nAxisGroup\nComputation\nCoordinate systems\nDynamics\nKinematics\nTrigger\nAxisGroup\nAXIS_GROUP_REF_SM3 (FunctionBlock)\nHelpers\nMovements\nDiagnostics\nMC_GroupReadActualAcceleration (FunctionBlock)\nMC_GroupReadActualPosition (FunctionBlock)\nMC_GroupReadActualVelocity (FunctionBlock)\nMC_GroupReadConfiguration (FunctionBlock)\nMC_GroupReadError (FunctionBlock)\nMC_GroupReadStatus (FunctionBlock)\nMC_ReadCoordinateTransform (FunctionBlock)\nMC_ReadKinTransform (FunctionBlock)\nSMC_GroupAddOffset (FunctionBlock)\nSMC_GroupAdditionalAxesTargetPositions (FunctionBlock)\nSMC_GroupConvertPosition (FunctionBlock)\nSMC_GroupGetContinuePosition (FunctionBlock)\nSMC_GroupGetContinueToolOffset (FunctionBlock)\nSMC_GroupReadPathAcceleration (FunctionBlock)\nSMC_GroupReadPathDynamics (FunctionBlock)\nSMC_GroupReadPathVelocity (FunctionBlock)\nSMC_GroupReadPlanningStatistics (FunctionBlock)\nSMC_GroupReadPositionInMovement (FunctionBlock)\nSMC_GroupReadRemainingTrajectoryDuration (FunctionBlock)\nSMC_GroupReadSetAcceleration (FunctionBlock)\nSMC_GroupReadSetJerk (FunctionBlock)\nSMC_GroupReadSetPosition (FunctionBlock)\nSMC_GroupReadSetVelocity (FunctionBlock)\nSMC_GroupTargetPosition (FunctionBlock)\nSMC_ReadKinTransformForAxis (FunctionBlock)\nMovement\nAdditionalAxes\nGroupInterrupt\nMC_GroupContinue (FunctionBlock)\nMC_GroupHalt (FunctionBlock)\nMC_GroupInterrupt (FunctionBlock)\nMC_GroupStop (FunctionBlock)\nMC_MoveCircularAbsolute (FunctionBlock)\nMC_MoveCircularRelative (FunctionBlock)\nMC_MoveDirectAbsolute (FunctionBlock)\nMC_MoveDirectRelative (FunctionBlock)\nMC_MoveLinearAbsolute (FunctionBlock)\nMC_MoveLinearRelative (FunctionBlock)\nSMC_GroupEnableResumeAfterError (FunctionBlock)\nSMC_GroupJog (FunctionBlock)\nSMC_GroupJog2 (FunctionBlock)\nSMC_GroupUpdateContinueData (FunctionBlock)\nSMC_GroupWait (FunctionBlock)\nSMC_MoveAdditionalAxes (FunctionBlock)\ninternal\nDivers\nKernel_CP\nFile and Project Information\nLibrary Reference\n3SLicense\nLibrary Identification\nLibrary Properties\nCmpApp\nLibrary Identification\nLibrary Properties\nCmpIecTask\nLibrary Identification\nLibrary Properties\nCmpLog\nLibrary Identification\nLibrary Properties\nFloatingPointUtils\nLibrary Identification\nLibrary Properties\nSM3_Basic\nLibrary Identification\nLibrary Properties\nLibrary Parameter\nSM3_CPKernelDefaults\nLibrary Identification\nLibrary Properties\nLibrary Parameter\nSM3_CommonPublic\nLibrary Identification\nLibrary Properties\nSM3_Dynamics\nLibrary Identification\nLibrary Properties\nSM3_Error\nLibrary Identification\nLibrary Properties\nSM3_RBase\nLibrary Identification\nLibrary Properties\nSM3_RCP\nLibrary Identification\nLibrary Properties\nSM3_RError\nLibrary Identification\nLibrary Properties\nSM3_Ramps\nLibrary Identification\nLibrary Properties\nSM3_Shared\nLibrary Identification\nLibrary Properties\nSM3_StringUtils\nLibrary Identification\nLibrary Properties\nSM3_TrajectoryGeneration\nLibrary Identification\nLibrary Properties\nSM3_Transformation\nLibrary Identification\nLibrary Properties\nStandard\nLibrary Identification\nLibrary Properties\nSysMem\nLibrary Identification\nLibrary Properties\nSysTarget\nLibrary Identification\nLibrary Properties\nSysTime\nLibrary Identification\nLibrary Properties\nSysTypes2 Interfaces\nLibrary Identification\nLibrary Properties\nSM3_Robotics\nDocs\n»\nSM3_Robotics\n»\nBasic\ntypes\n»\nMC_TRANSITION_MODE (ENUM)\nMC_TRANSITION_MODE (ENUM)\nÂ¶\nTYPE MC_TRANSITION_MODE :\nThe transition mode describes how consecutive motion commands are blended.\nAttributes:\nqualified_only\nInOut:\nName\nComment\nTMNone\nNo blending.\nTMStartVelocity\nVelocity based blending.\nThe blending points, Aâ and Bâ are chosen so that blending can be\ndone without decelerating, based on a heuristic.\nFor estimating Aâ and Bâ, the commanded dynamic limits are used, the\noverride and the ancillary axis limits are not considered.\nThe goal is that the override and the ancillary limits donât influence\nthe path in space.\nTransitionParameter[0] is a factor that influences the blending points\nAâ and Bâ.\nA factor of 1 (100%) means that blending is started when the deceleration\nphase would begin on the unmodified first movement, and finished when the\nacceleration phase would end on the unmodified second movement.\nLarger factors lead to a larger blending area, smaller factors\nlead to a smaller blending area.\nThe value of TransitionParameter[2] determines which axes are considered\nfor the velocity.  See\nSMC_StartVelocityAxes\n.\nNote on aborting: the factor is taken into account, too, but\ndepending on the aborting movement, a factor of 1 does not\nnecessarily mean that constant velocity can be kept.\nIt is recommended to use the function block\nSMC_StartVelocity\nto\nset the transition mode and transition parameters of movement\nfunction blocks.\nTMCornerDistance\nDistance based blending.\nThe value of TransitionParameter[0] specifies the distance between\nthe corner (i.e. the end of the first movement) and the cut points\nwhere the blending starts and ends.\nNote\nIn case of tracking between different coordinate systems and\ntracking with PTP movements, the corner distance is evaluated when\nthe axis group plans the trajectory on the blended path. This means\nthat, when the axis group travels the blending, the distance may be\nslightly different, depending on the movement of the tracked\ncoordinate systems.\nIt is recommended to use the function block\nSMC_CornerDistance\nto\nset the transition mode and transition parameters of movement\nfunction blocks.\nTMAxisDistance\nAxis distance based blending.\nThis transition mode blends movements in axis space where the blending point\nis determined by giving a distance of the axes to the end point of the first\nmovement / start point of the second movement.\nThe distance is specified by two values:\nA linear distance (TransitionParameter[0]) for linear axes\nplus a rotary distance (TransitionParameter[1]) for rotary axes.\nThe linear distance has the units of the linear axes (e.g. mm), the rotary\ndistance has the unit angular degrees.\nThe value of TransitionParameter[2] determines which axes are considered\nfor the axis distance. See\nSMC_AxisDistanceAxes\n.\nThe value of TransitionParameter[3] determines how the\ndistances are interpreted. See\nSMC_AxisDistanceSubMode\n.\nIt is recommended to use the function block\nSMC_AxisDistanceTransition\nor\nthe function\nSMC_AxisDistanceTransitionParam\nto set the transition mode\nand/or transition parameters of movement function blocks.",
  "tables": [
    {
      "headers": [
        "Name",
        "Comment"
      ],
      "rows": [
        {
          "Name": "TMNone",
          "Comment": "No blending."
        },
        {
          "Name": "TMStartVelocity",
          "Comment": "Velocity based blending.The blending points, Aâ and Bâ are chosen so that blending can be\ndone without decelerating, based on a heuristic.For estimating Aâ and Bâ, the commanded dynamic limits are used, the\noverride and the ancillary axis limits are not considered.\nThe goal is that the override and the ancillary limits donât influence\nthe path in space.TransitionParameter[0] is a factor that influences the blending points\nAâ and Bâ.\nA factor of 1 (100%) means that blending is started when the deceleration\nphase would begin on the unmodified first movement, and finished when the\nacceleration phase would end on the unmodified second movement.\nLarger factors lead to a larger blending area, smaller factors\nlead to a smaller blending area.The value of TransitionParameter[2] determines which axes are considered\nfor the velocity.  SeeSMC_StartVelocityAxes.Note on aborting: the factor is taken into account, too, but\ndepending on the aborting movement, a factor of 1 does not\nnecessarily mean that constant velocity can be kept.It is recommended to use the function blockSMC_StartVelocityto\nset the transition mode and transition parameters of movement\nfunction blocks."
        },
        {
          "Name": "TMCornerDistance",
          "Comment": "Distance based blending.The value of TransitionParameter[0] specifies the distance between\nthe corner (i.e. the end of the first movement) and the cut points\nwhere the blending starts and ends.NoteIn case of tracking between different coordinate systems and\ntracking with PTP movements, the corner distance is evaluated when\nthe axis group plans the trajectory on the blended path. This means\nthat, when the axis group travels the blending, the distance may be\nslightly different, depending on the movement of the tracked\ncoordinate systems.It is recommended to use the function blockSMC_CornerDistanceto\nset the transition mode and transition parameters of movement\nfunction blocks."
        },
        {
          "Name": "TMAxisDistance",
          "Comment": "Axis distance based blending.This transition mode blends movements in axis space where the blending point\nis determined by giving a distance of the axes to the end point of the first\nmovement / start point of the second movement.The distance is specified by two values:\nA linear distance (TransitionParameter[0]) for linear axes\nplus a rotary distance (TransitionParameter[1]) for rotary axes.\nThe linear distance has the units of the linear axes (e.g. mm), the rotary\ndistance has the unit angular degrees.The value of TransitionParameter[2] determines which axes are considered\nfor the axis distance. SeeSMC_AxisDistanceAxes.The value of TransitionParameter[3] determines how the\ndistances are interpreted. SeeSMC_AxisDistanceSubMode.It is recommended to use the function blockSMC_AxisDistanceTransitionor\nthe functionSMC_AxisDistanceTransitionParamto set the transition mode\nand/or transition parameters of movement function blocks."
        }
      ]
    }
  ]
}