{
  "library": "MQTT Client SL",
  "title": "MQTT_QOS (Enum)",
  "url": "https://content.helpme-codesys.com/en/libs/MQTT Client SL/Current/MQTT-Client/Common/Enums/MQTT_QOS.html",
  "page_title": "MQTT_QOS (ENUM)",
  "text": "MQTT Client\nCommon\nEnums\nCOMMUNICATION_MODE (Enum)\nFILTER_MODE (Enum)\nMQTT_ERROR (Enum)\nMQTT_QOS (Enum)\nMQTT_VERSION (Enum)\nV5\nFunction Blocks\nMQTTClient (FunctionBlock)\nMQTTPublish (FunctionBlock)\nMQTTSubscribe (FunctionBlock)\nParams\nMQTTParam (ParamList)\nStructs\nMQTTV5\nUTF-8\nConvertUTF16toUTF8 (Function)\nConvertUTF8toUTF16 (Function)\nFile and Project Information\nLibrary Reference\n3SLicense\nLibrary Identification\nLibrary Properties\nCAA FB Factory\nLibrary Identification\nLibrary Properties\nCAA Types Extern\nLibrary Identification\nLibrary Properties\nCmpCrypto\nLibrary Identification\nLibrary Properties\nCmpErrors2 Interfaces\nLibrary Identification\nLibrary Properties\nCmpLog\nLibrary Identification\nLibrary Properties\nCmpSchedule\nLibrary Identification\nLibrary Properties\nCmpX509Cert\nLibrary Identification\nLibrary Properties\nCommon Behaviour Model\nLibrary Identification\nLibrary Properties\nComponent Manager\nLibrary Identification\nLibrary Properties\nElement Collections\nLibrary Identification\nLibrary Properties\nMemoryUtils\nLibrary Identification\nLibrary Properties\nNet Base Services\nLibrary Identification\nLibrary Properties\nStandard\nLibrary Identification\nLibrary Properties\nStringUtils\nLibrary Identification\nLibrary Properties\nSysMem\nLibrary Identification\nLibrary Properties\nSysSocket2\nLibrary Identification\nLibrary Properties\nSysSocket2 Implementation\nLibrary Identification\nLibrary Properties\nSysTime\nLibrary Identification\nLibrary Properties\nSysTypes2 Interfaces\nLibrary Identification\nLibrary Properties\nWeb Socket Client SL\nLibrary Identification\nLibrary Properties\nMQTT Client SL\nDocs\n»\nMQTT\nClient\n»\nCommon\n»\nEnums\n»\nMQTT_QOS (ENUM)\nMQTT_QOS (ENUM)\nÂ¶\nTYPE MQTT_QOS :\nAttributes:\nqualified_only\nInOut:\nName\nInitial\nComment\nQoS0\n0\nSend Message 1x, if disconnect from server then send can\nfail.\nQoS1\n1\nSend Message Nx, until Receive is acknowledged.\nQoS2\n2\nSend Message 1x, if disconnect from server then send is\nalways successfully.",
  "tables": [
    {
      "headers": [
        "Name",
        "Initial",
        "Comment"
      ],
      "rows": [
        {
          "Name": "QoS0",
          "Initial": "0",
          "Comment": "Send Message 1x, if disconnect from server then send can\nfail."
        },
        {
          "Name": "QoS1",
          "Initial": "1",
          "Comment": "Send Message Nx, until Receive is acknowledged."
        },
        {
          "Name": "QoS2",
          "Initial": "2",
          "Comment": "Send Message 1x, if disconnect from server then send is\nalways successfully."
        }
      ]
    }
  ]
}