{
  "library": "MQTT Client SL",
  "title": "MQTTWillProperties (Struct)",
  "url": "https://content.helpme-codesys.com/en/libs/MQTT Client SL/Current/MQTT-Client/Common/Structs/MQTTV5/Properties/MQTTWillProperties.html",
  "page_title": "MQTTWillProperties (STRUCT)",
  "text": "MQTT Client\nCommon\nEnums\nCOMMUNICATION_MODE (Enum)\nFILTER_MODE (Enum)\nMQTT_ERROR (Enum)\nMQTT_QOS (Enum)\nMQTT_VERSION (Enum)\nV5\nFunction Blocks\nMQTTClient (FunctionBlock)\nMQTTPublish (FunctionBlock)\nMQTTSubscribe (FunctionBlock)\nParams\nMQTTParam (ParamList)\nStructs\nMQTTV5\nUTF-8\nConvertUTF16toUTF8 (Function)\nConvertUTF8toUTF16 (Function)\nFile and Project Information\nLibrary Reference\n3SLicense\nLibrary Identification\nLibrary Properties\nCAA FB Factory\nLibrary Identification\nLibrary Properties\nCAA Types Extern\nLibrary Identification\nLibrary Properties\nCmpCrypto\nLibrary Identification\nLibrary Properties\nCmpErrors2 Interfaces\nLibrary Identification\nLibrary Properties\nCmpLog\nLibrary Identification\nLibrary Properties\nCmpSchedule\nLibrary Identification\nLibrary Properties\nCmpX509Cert\nLibrary Identification\nLibrary Properties\nCommon Behaviour Model\nLibrary Identification\nLibrary Properties\nComponent Manager\nLibrary Identification\nLibrary Properties\nElement Collections\nLibrary Identification\nLibrary Properties\nMemoryUtils\nLibrary Identification\nLibrary Properties\nNet Base Services\nLibrary Identification\nLibrary Properties\nStandard\nLibrary Identification\nLibrary Properties\nStringUtils\nLibrary Identification\nLibrary Properties\nSysMem\nLibrary Identification\nLibrary Properties\nSysSocket2\nLibrary Identification\nLibrary Properties\nSysSocket2 Implementation\nLibrary Identification\nLibrary Properties\nSysTime\nLibrary Identification\nLibrary Properties\nSysTypes2 Interfaces\nLibrary Identification\nLibrary Properties\nWeb Socket Client SL\nLibrary Identification\nLibrary Properties\nMQTT Client SL\nDocs\n»\nMQTT\nClient\n»\nCommon\n»\nStructs\n»\nMQTTV5\n»\nProperties\n»\nMQTTWillProperties (STRUCT)\nMQTTWillProperties (STRUCT)\nÂ¶\nTYPE MQTTWillProperties : STRUCT\nWill properties (MQTT V5)\nInOut:\nName\nType\nComment\nbPayloadFormatIndicator\nBYTE\nPayload Format: 0: Binary Data, 1: UTF-8\nudiMessageExpiryInterval\nUDINT\nExpiry interval of the message in seconds\nwsContentType\nWSTRING\nMIME style content type of the payload\nwsResponseTopic\nWSTRING\nSome applications or standards might wish to run a Request/Response interaction over MQTT.\nThe Resopnse Topic can be used for this purpose.\nudiCorrelationDataSize\nUDINT\nSize of the correlation data buffer\n|paCorrelationData|\npaCorrelationData\nPOINTER TO BYTE\nPointer to correlation data buffer. The Correlation Data is\nused by the sender of the Request Message to identify which\nrequest the Response Message is for when it is received.\nudiWillDelayInterval\nUDINT\nThe Server delays publishing the Clientâs Will Message until the Will Delay Interval (in seconds)\nhas passed or the Session ends, whichever happens first.\nuserProperties\nARRAY\n[0..(MQTTParam.g_udiMaxUserProperties\n- 1)] OF\nMQTTStringPair\nUser defined properties",
  "tables": [
    {
      "headers": [
        "Name",
        "Type",
        "Comment"
      ],
      "rows": [
        {
          "Name": "bPayloadFormatIndicator",
          "Type": "BYTE",
          "Comment": "Payload Format: 0: Binary Data, 1: UTF-8"
        },
        {
          "Name": "udiMessageExpiryInterval",
          "Type": "UDINT",
          "Comment": "Expiry interval of the message in seconds"
        },
        {
          "Name": "wsContentType",
          "Type": "WSTRING",
          "Comment": "MIME style content type of the payload"
        },
        {
          "Name": "wsResponseTopic",
          "Type": "WSTRING",
          "Comment": "Some applications or standards might wish to run a Request/Response interaction over MQTT.\nThe Resopnse Topic can be used for this purpose."
        },
        {
          "Name": "udiCorrelationDataSize",
          "Type": "UDINT",
          "Comment": "Size of the correlation data buffer|paCorrelationData|"
        },
        {
          "Name": "paCorrelationData",
          "Type": "POINTER TO BYTE",
          "Comment": "Pointer to correlation data buffer. The Correlation Data is\nused by the sender of the Request Message to identify which\nrequest the Response Message is for when it is received."
        },
        {
          "Name": "udiWillDelayInterval",
          "Type": "UDINT",
          "Comment": "The Server delays publishing the Clientâs Will Message until the Will Delay Interval (in seconds)\nhas passed or the Session ends, whichever happens first."
        },
        {
          "Name": "userProperties",
          "Type": "ARRAY\n[0..(MQTTParam.g_udiMaxUserProperties\n- 1)] OFMQTTStringPair",
          "Comment": "User defined properties"
        }
      ]
    }
  ]
}