{
  "library": "MQTT Client SL",
  "title": "MQTTPublishProperties (Struct)",
  "url": "https://content.helpme-codesys.com/en/libs/MQTT Client SL/Current/MQTT-Client/Common/Structs/MQTTV5/Properties/MQTTPublishProperties.html",
  "page_title": "MQTTPublishProperties (STRUCT)",
  "text": "MQTT Client\nCommon\nEnums\nCOMMUNICATION_MODE (Enum)\nFILTER_MODE (Enum)\nMQTT_ERROR (Enum)\nMQTT_QOS (Enum)\nMQTT_VERSION (Enum)\nV5\nFunction Blocks\nMQTTClient (FunctionBlock)\nMQTTPublish (FunctionBlock)\nMQTTSubscribe (FunctionBlock)\nParams\nMQTTParam (ParamList)\nStructs\nMQTTV5\nUTF-8\nConvertUTF16toUTF8 (Function)\nConvertUTF8toUTF16 (Function)\nFile and Project Information\nLibrary Reference\n3SLicense\nLibrary Identification\nLibrary Properties\nCAA FB Factory\nLibrary Identification\nLibrary Properties\nCAA Types Extern\nLibrary Identification\nLibrary Properties\nCmpCrypto\nLibrary Identification\nLibrary Properties\nCmpErrors2 Interfaces\nLibrary Identification\nLibrary Properties\nCmpLog\nLibrary Identification\nLibrary Properties\nCmpSchedule\nLibrary Identification\nLibrary Properties\nCmpX509Cert\nLibrary Identification\nLibrary Properties\nCommon Behaviour Model\nLibrary Identification\nLibrary Properties\nComponent Manager\nLibrary Identification\nLibrary Properties\nElement Collections\nLibrary Identification\nLibrary Properties\nMemoryUtils\nLibrary Identification\nLibrary Properties\nNet Base Services\nLibrary Identification\nLibrary Properties\nStandard\nLibrary Identification\nLibrary Properties\nStringUtils\nLibrary Identification\nLibrary Properties\nSysMem\nLibrary Identification\nLibrary Properties\nSysSocket2\nLibrary Identification\nLibrary Properties\nSysSocket2 Implementation\nLibrary Identification\nLibrary Properties\nSysTime\nLibrary Identification\nLibrary Properties\nSysTypes2 Interfaces\nLibrary Identification\nLibrary Properties\nWeb Socket Client SL\nLibrary Identification\nLibrary Properties\nMQTT Client SL\nDocs\n»\nMQTT\nClient\n»\nCommon\n»\nStructs\n»\nMQTTV5\n»\nProperties\n»\nMQTTPublishProperties (STRUCT)\nMQTTPublishProperties (STRUCT)\nÂ¶\nTYPE MQTTPublishProperties : STRUCT\nPublish properties (MQTT V5)\nThe structure is used for sending and receiving properties.\nNotice: Some fields are only relevant for the publisher or the subscriber.\nInOut:\nName\nType\nComment\nbPayloadFormatIndicator\nBYTE\nPayload Format: 0: Binary Data, 1: UTF-8\n(relevant for publisher and subscriber)\nudiMessageExpiryInterval\nUDINT\nExpiry interval of the message in seconds\n(relevant for publisher and subscriber)\nwsContentType\nWSTRING\nMIME style content type of the payload\n(relevant for publisher and subscriber)\nwsResponseTopic\nWSTRING(1024)\nSome applications or standards might wish to run a Request/Response interaction over MQTT.\nThe Resopnse Topic can be used for this purpose.\n(relevant for publisher and subscriber)\nudiCorrelationDataSize\nUDINT\nSize of the correlation data buffer\n|paCorrelationData|\n(relevant for publisher and subscriber)\npaCorrelationData\nPOINTER TO BYTE\nPointer to correlation data buffer. The Correlation Data is used by the sender of the Request Message to identify which request the Response Message is for when it is received.\n(relevant for publisher and subscriber)\nudiSubscriptionIdentifier\nUDINT\nThe subscription identifier of the last received message (see output of the subscriber function block).\nThe subscription identifier can be set via MQTTSubscribeProperties.udiSubscriptionIdentifier.\nThe identifier has no effect for the publisher function block.\n(relevant for the subscriber)\nuiTopicAlias\nUINT\nA Topic Alias is an integer value that is used to identify the Topic instead of using the Topic Name.\nIf a Topic Alias mapping has been set at the receiver (the broker), a sender can send a PUBLISH packet that contains\nthat Topic Alias and a zero length Topic Name. The receiver (the broker) then treats the incoming PUBLISH as if it\nhad contained the Topic Name of the Topic Alias.\nThe Topic Alias has no effect for the subscriber function block and is not transferd\nfrom the broker to the subscriber.\n(relevant for the publisher)\nuserProperties\nARRAY\n[0..(MQTTParam.g_udiMaxUserProperties\n- 1)] OF\nMQTTStringPair\nUser defined properties\n(relevant for publisher and subscriber)",
  "tables": [
    {
      "headers": [
        "Name",
        "Type",
        "Comment"
      ],
      "rows": [
        {
          "Name": "bPayloadFormatIndicator",
          "Type": "BYTE",
          "Comment": "Payload Format: 0: Binary Data, 1: UTF-8\n(relevant for publisher and subscriber)"
        },
        {
          "Name": "udiMessageExpiryInterval",
          "Type": "UDINT",
          "Comment": "Expiry interval of the message in seconds\n(relevant for publisher and subscriber)"
        },
        {
          "Name": "wsContentType",
          "Type": "WSTRING",
          "Comment": "MIME style content type of the payload\n(relevant for publisher and subscriber)"
        },
        {
          "Name": "wsResponseTopic",
          "Type": "WSTRING(1024)",
          "Comment": "Some applications or standards might wish to run a Request/Response interaction over MQTT.\nThe Resopnse Topic can be used for this purpose.\n(relevant for publisher and subscriber)"
        },
        {
          "Name": "udiCorrelationDataSize",
          "Type": "UDINT",
          "Comment": "Size of the correlation data buffer|paCorrelationData|(relevant for publisher and subscriber)"
        },
        {
          "Name": "paCorrelationData",
          "Type": "POINTER TO BYTE",
          "Comment": "Pointer to correlation data buffer. The Correlation Data is used by the sender of the Request Message to identify which request the Response Message is for when it is received.\n(relevant for publisher and subscriber)"
        },
        {
          "Name": "udiSubscriptionIdentifier",
          "Type": "UDINT",
          "Comment": "The subscription identifier of the last received message (see output of the subscriber function block).\nThe subscription identifier can be set via MQTTSubscribeProperties.udiSubscriptionIdentifier.\nThe identifier has no effect for the publisher function block.\n(relevant for the subscriber)"
        },
        {
          "Name": "uiTopicAlias",
          "Type": "UINT",
          "Comment": "A Topic Alias is an integer value that is used to identify the Topic instead of using the Topic Name.\nIf a Topic Alias mapping has been set at the receiver (the broker), a sender can send a PUBLISH packet that contains\nthat Topic Alias and a zero length Topic Name. The receiver (the broker) then treats the incoming PUBLISH as if it\nhad contained the Topic Name of the Topic Alias.\nThe Topic Alias has no effect for the subscriber function block and is not transferd\nfrom the broker to the subscriber.\n(relevant for the publisher)"
        },
        {
          "Name": "userProperties",
          "Type": "ARRAY\n[0..(MQTTParam.g_udiMaxUserProperties\n- 1)] OFMQTTStringPair",
          "Comment": "User defined properties\n(relevant for publisher and subscriber)"
        }
      ]
    }
  ]
}