{
  "library": "MQTT Client SL",
  "title": "MQTTConnectProperties (Struct)",
  "url": "https://content.helpme-codesys.com/en/libs/MQTT Client SL/Current/MQTT-Client/Common/Structs/MQTTV5/Properties/MQTTConnectProperties.html",
  "page_title": "MQTTConnectProperties (STRUCT)",
  "text": "MQTT Client\nCommon\nEnums\nCOMMUNICATION_MODE (Enum)\nFILTER_MODE (Enum)\nMQTT_ERROR (Enum)\nMQTT_QOS (Enum)\nMQTT_VERSION (Enum)\nV5\nFunction Blocks\nMQTTClient (FunctionBlock)\nMQTTPublish (FunctionBlock)\nMQTTSubscribe (FunctionBlock)\nParams\nMQTTParam (ParamList)\nStructs\nMQTTV5\nUTF-8\nConvertUTF16toUTF8 (Function)\nConvertUTF8toUTF16 (Function)\nFile and Project Information\nLibrary Reference\n3SLicense\nLibrary Identification\nLibrary Properties\nCAA FB Factory\nLibrary Identification\nLibrary Properties\nCAA Types Extern\nLibrary Identification\nLibrary Properties\nCmpCrypto\nLibrary Identification\nLibrary Properties\nCmpErrors2 Interfaces\nLibrary Identification\nLibrary Properties\nCmpLog\nLibrary Identification\nLibrary Properties\nCmpSchedule\nLibrary Identification\nLibrary Properties\nCmpX509Cert\nLibrary Identification\nLibrary Properties\nCommon Behaviour Model\nLibrary Identification\nLibrary Properties\nComponent Manager\nLibrary Identification\nLibrary Properties\nElement Collections\nLibrary Identification\nLibrary Properties\nMemoryUtils\nLibrary Identification\nLibrary Properties\nNet Base Services\nLibrary Identification\nLibrary Properties\nStandard\nLibrary Identification\nLibrary Properties\nStringUtils\nLibrary Identification\nLibrary Properties\nSysMem\nLibrary Identification\nLibrary Properties\nSysSocket2\nLibrary Identification\nLibrary Properties\nSysSocket2 Implementation\nLibrary Identification\nLibrary Properties\nSysTime\nLibrary Identification\nLibrary Properties\nSysTypes2 Interfaces\nLibrary Identification\nLibrary Properties\nWeb Socket Client SL\nLibrary Identification\nLibrary Properties\nMQTT Client SL\nDocs\n»\nMQTT\nClient\n»\nCommon\n»\nStructs\n»\nMQTTV5\n»\nProperties\n»\nMQTTConnectProperties (STRUCT)\nMQTTConnectProperties (STRUCT)\nÂ¶\nTYPE MQTTConnectProperties : STRUCT\nConnect properties (MQTT V5)\nInOut:\nName\nType\nComment\nudiSessionExpiryInterval\nUDINT\nSession Expiry Interval: Time in seconds a session retains\nafter a disconnect.\nwsAuthenticationMethod\nWSTRING\nName of the authentication method\npbAuthenticationData\nPOINTER TO BYTE\nBinary Data containing authentication data\nudiAuthenticationDataSize\nUDINT\nSize of pbAuthenticationData\nbRequestProblemInformation\nBYTE\nThe Client uses this value to indicate whether the Reason\nString or User Properties are sent in the case of failures.\nbRequestResponseInformation\nBYTE\nThis value can be used to request the Server to return\nResponse Information.\nuiReceiveMaximum\nUINT\nThe Client uses this value to limit the number of QoS 1 and QoS 2 publications that it is willing to process concurrently.\nThere is no mechanism to limit the QoS 0 publications that the Server might try to send.\nuiTopicAliasMaximum\nUINT\nThis value indicates the highest value that the Server will\naccept as a Topic Alias sent by the Client.\nudiMaximumPacketSize\nUDINT\nThe Client uses the Maximum Packet Size to inform the Server\nthat it will not process packets exceeding this limit.\nuserProperties\nARRAY\n[0..(MQTTParam.g_udiMaxUserProperties\n- 1)] OF\nMQTTStringPair\nUser defined properties",
  "tables": [
    {
      "headers": [
        "Name",
        "Type",
        "Comment"
      ],
      "rows": [
        {
          "Name": "udiSessionExpiryInterval",
          "Type": "UDINT",
          "Comment": "Session Expiry Interval: Time in seconds a session retains\nafter a disconnect."
        },
        {
          "Name": "wsAuthenticationMethod",
          "Type": "WSTRING",
          "Comment": "Name of the authentication method"
        },
        {
          "Name": "pbAuthenticationData",
          "Type": "POINTER TO BYTE",
          "Comment": "Binary Data containing authentication data"
        },
        {
          "Name": "udiAuthenticationDataSize",
          "Type": "UDINT",
          "Comment": "Size of pbAuthenticationData"
        },
        {
          "Name": "bRequestProblemInformation",
          "Type": "BYTE",
          "Comment": "The Client uses this value to indicate whether the Reason\nString or User Properties are sent in the case of failures."
        },
        {
          "Name": "bRequestResponseInformation",
          "Type": "BYTE",
          "Comment": "This value can be used to request the Server to return\nResponse Information."
        },
        {
          "Name": "uiReceiveMaximum",
          "Type": "UINT",
          "Comment": "The Client uses this value to limit the number of QoS 1 and QoS 2 publications that it is willing to process concurrently.\nThere is no mechanism to limit the QoS 0 publications that the Server might try to send."
        },
        {
          "Name": "uiTopicAliasMaximum",
          "Type": "UINT",
          "Comment": "This value indicates the highest value that the Server will\naccept as a Topic Alias sent by the Client."
        },
        {
          "Name": "udiMaximumPacketSize",
          "Type": "UDINT",
          "Comment": "The Client uses the Maximum Packet Size to inform the Server\nthat it will not process packets exceeding this limit."
        },
        {
          "Name": "userProperties",
          "Type": "ARRAY\n[0..(MQTTParam.g_udiMaxUserProperties\n- 1)] OFMQTTStringPair",
          "Comment": "User defined properties"
        }
      ]
    }
  ]
}