{
  "library": "MQTT Client SL",
  "title": "MQTT_ERROR (Enum)",
  "url": "https://content.helpme-codesys.com/en/libs/MQTT Client SL/Current/MQTT-Client/Common/Enums/MQTT_ERROR.html",
  "page_title": "MQTT_ERROR (ENUM)",
  "text": "MQTT Client\nCommon\nEnums\nCOMMUNICATION_MODE (Enum)\nFILTER_MODE (Enum)\nMQTT_ERROR (Enum)\nMQTT_QOS (Enum)\nMQTT_VERSION (Enum)\nV5\nFunction Blocks\nMQTTClient (FunctionBlock)\nMQTTPublish (FunctionBlock)\nMQTTSubscribe (FunctionBlock)\nParams\nMQTTParam (ParamList)\nStructs\nMQTTV5\nUTF-8\nConvertUTF16toUTF8 (Function)\nConvertUTF8toUTF16 (Function)\nFile and Project Information\nLibrary Reference\n3SLicense\nLibrary Identification\nLibrary Properties\nCAA FB Factory\nLibrary Identification\nLibrary Properties\nCAA Types Extern\nLibrary Identification\nLibrary Properties\nCmpCrypto\nLibrary Identification\nLibrary Properties\nCmpErrors2 Interfaces\nLibrary Identification\nLibrary Properties\nCmpLog\nLibrary Identification\nLibrary Properties\nCmpSchedule\nLibrary Identification\nLibrary Properties\nCmpX509Cert\nLibrary Identification\nLibrary Properties\nCommon Behaviour Model\nLibrary Identification\nLibrary Properties\nComponent Manager\nLibrary Identification\nLibrary Properties\nElement Collections\nLibrary Identification\nLibrary Properties\nMemoryUtils\nLibrary Identification\nLibrary Properties\nNet Base Services\nLibrary Identification\nLibrary Properties\nStandard\nLibrary Identification\nLibrary Properties\nStringUtils\nLibrary Identification\nLibrary Properties\nSysMem\nLibrary Identification\nLibrary Properties\nSysSocket2\nLibrary Identification\nLibrary Properties\nSysSocket2 Implementation\nLibrary Identification\nLibrary Properties\nSysTime\nLibrary Identification\nLibrary Properties\nSysTypes2 Interfaces\nLibrary Identification\nLibrary Properties\nWeb Socket Client SL\nLibrary Identification\nLibrary Properties\nMQTT Client SL\nDocs\n»\nMQTT\nClient\n»\nCommon\n»\nEnums\n»\nMQTT_ERROR (ENUM)\nMQTT_ERROR (ENUM)\nÂ¶\nTYPE MQTT_ERROR :\nAttributes:\nqualified_only\nInOut:\nName\nInitial\nComment\nNO_ERROR\n0\nNo error\nTCP_INIT_ERROR\n1\nUnable to initialize the TCP socket\nTCP_READ_ERROR\n2\nError while reading response\nTCP_WRITE_ERROR\n3\nError while sending the request\nMAX_RESPONSE_SIZE_EXCEEDED\n4\nSize of incoming packet exceeds the maximum packet size. See\nMQTTParam.g_udiMaxPacketSize\nDECODE_REMAINING_LENGTH_MALFORMED\n5\nMalformation during Decoding of Remaining Length of Packet\nRESPONSE_PACKET_EMPTY\n6\nThe Response Packet is empty\nINVALID_PACKET_TYPE\n7\nInvalid Packet Type in first byte of Fixed Header\nINVALID_PACKET_BIT_FLAGS\n8\nInvalid Packet Bit Flags in first byte of Fixed Header\nINVALID_PACKET\n9\nInvalid Packet\nKEEP_ALIVE_TIME_EXCEEDED\n10\nKeep Alive Time is too much\nWRONG_SESSION_PRESENT_CONNACK\n11\nWrong Session Present in CONNACK packet\nUNACCEPTABLE_PROTOCOL_VERION\n12\nConnection to Broker is Refused, because of Unacceptable\nProtocol Version\nIDENTIFIER_REJECTED\n13\nConnection to Broker is Refused, because of Rejection of\nClient Identifier\nSERVER_UNAVAILABLE\n14\nConnection to Broker is Refused, because the Server Broker\nis not available\nBAD_USER_NAME_PASSWORD\n15\nConnection to Broker is Refused, because of Bad User name or\nBad Password\nNOT_AUTHORIZED\n16\nConnection to Broker is Refused, because of Not Authorized\naccess\nTOPIC_FILTER_EMPTY\n17\nTopic Filter is empty ââ, MUST be at least one character\nlong\nTOPIC_NAME_NOT_ALLOWED_WILDCARD\n18\nTopic Name contains Wildcards, what is not allowed. Only\nTopic Filter can contain these\nTOPIC_INVALID_LENGTH\n19\nTopic Length out of valid range (valid range: 1 - 1024)\nTOPIC_IS_EMPTY\n20\nTopic name is empty\nSUBSCRIBE_FAILURE\n21\nSubscription Failure\nADD_MQTT_PACKET_COLLECTION_ERROR\n22\nCollection Error while trying to add a mqtt packet to the\nstack\nADD_SUBSCRIBER_COLLECTION_ERROR\n23\nCollection Error while trying to add a subscriber to the\nstack\nREMOVE_SUBSCRIBER_COLLECTION_ERROR\n24\nCollection Error while trying to remove a subscriber from\nthe stack\nACKNOWLEDGE_TIMEOUT\n25\nClient waits for ping response from Server, but Server does\nnot response within a given time interval (2 * ping\ninterval)\nALLOCATED_PAYLOAD_SIZE_EXCEEDED\n26\nThe Size of the received payload is more than given\nallocated memory\nMAX_NUMBER_OF_PACKETS_EXCEEDED\n27\nThe maximum size of packets has been exceeded\nCAN_NOT_ADD_ELEMENT_TO_QUEUE\n28\nCan not add the element to queue (maybe the maximum size has\nbeen exceeded)\nQUERYINTERFACE_ERROR\n29\nCall of function __QUERYINTERFACE failed (internal error)\nTIME_OUT\n30\nAction returned with timeout error.\nINVALID_LICENSE\n31\nNo valid license found or demo mode has expired.\nCLIENT_NOT_CONNECTED\n32\nThe MQTT client is not connected to a broker.\nRESOLVE_HOSTNAME_FAILED\n33\nThe hostname can not be resolved.\nMAX_REQUEST_SIZE_EXCEEDED\n34\nSize of publish packet packet exceeds the maximum packet\nsize\nUNSUPPORTED_VERSION\n35\nUnsupported MQTT version\nOPERATION_NOT_SUCCESSFUL\n36\nThe operation was not successful. See eReasonCode for more\ninformation. (MQTT V5 only)\nSEND_QUOTA_LIMIT_REACHED\n37\nThe send quota limit has been reached. Try to publish the\nmessage later.\nINVALID_REASON_CODE\n38\nThe reason code is not allowed in this context.\nMAX_RECEIVE_BUFFER_SIZE_EXCEEDED\n39\nSize of incoming packets exceeds the maximum size of the\nreceive buffer. See MQTTParam.g_udiMaxReceiveBufferSize\nMAX_TOPIC_LEVEL_EXCEEDED\n40\nThe maximum topic level has been exceeded.\nMAX_STRING_LENGTH_EXCEEDED\n41\nThe maximum length of a STRING has been exceeded (Maximum\nlength: 1024).\nMAX_CORRELATION_DATA_LENGTH_EXCEEDED\n42\nThe maximum size of Correlation Data has been exceeded. See\nMQTTParam.g_udiMaxCorrelationDataSize\nMAX_NUMBER_OF_PUBLISHER_AND_SUBSCRIBER_EXCEEDED\n43\nThe maximum number of publishers and subscribers has been\nexceeded. See MQTTParam.g_udiMaxPublishersAndSubscribers",
  "tables": [
    {
      "headers": [
        "Name",
        "Initial",
        "Comment"
      ],
      "rows": [
        {
          "Name": "NO_ERROR",
          "Initial": "0",
          "Comment": "No error"
        },
        {
          "Name": "TCP_INIT_ERROR",
          "Initial": "1",
          "Comment": "Unable to initialize the TCP socket"
        },
        {
          "Name": "TCP_READ_ERROR",
          "Initial": "2",
          "Comment": "Error while reading response"
        },
        {
          "Name": "TCP_WRITE_ERROR",
          "Initial": "3",
          "Comment": "Error while sending the request"
        },
        {
          "Name": "MAX_RESPONSE_SIZE_EXCEEDED",
          "Initial": "4",
          "Comment": "Size of incoming packet exceeds the maximum packet size. See\nMQTTParam.g_udiMaxPacketSize"
        },
        {
          "Name": "DECODE_REMAINING_LENGTH_MALFORMED",
          "Initial": "5",
          "Comment": "Malformation during Decoding of Remaining Length of Packet"
        },
        {
          "Name": "RESPONSE_PACKET_EMPTY",
          "Initial": "6",
          "Comment": "The Response Packet is empty"
        },
        {
          "Name": "INVALID_PACKET_TYPE",
          "Initial": "7",
          "Comment": "Invalid Packet Type in first byte of Fixed Header"
        },
        {
          "Name": "INVALID_PACKET_BIT_FLAGS",
          "Initial": "8",
          "Comment": "Invalid Packet Bit Flags in first byte of Fixed Header"
        },
        {
          "Name": "INVALID_PACKET",
          "Initial": "9",
          "Comment": "Invalid Packet"
        },
        {
          "Name": "KEEP_ALIVE_TIME_EXCEEDED",
          "Initial": "10",
          "Comment": "Keep Alive Time is too much"
        },
        {
          "Name": "WRONG_SESSION_PRESENT_CONNACK",
          "Initial": "11",
          "Comment": "Wrong Session Present in CONNACK packet"
        },
        {
          "Name": "UNACCEPTABLE_PROTOCOL_VERION",
          "Initial": "12",
          "Comment": "Connection to Broker is Refused, because of Unacceptable\nProtocol Version"
        },
        {
          "Name": "IDENTIFIER_REJECTED",
          "Initial": "13",
          "Comment": "Connection to Broker is Refused, because of Rejection of\nClient Identifier"
        },
        {
          "Name": "SERVER_UNAVAILABLE",
          "Initial": "14",
          "Comment": "Connection to Broker is Refused, because the Server Broker\nis not available"
        },
        {
          "Name": "BAD_USER_NAME_PASSWORD",
          "Initial": "15",
          "Comment": "Connection to Broker is Refused, because of Bad User name or\nBad Password"
        },
        {
          "Name": "NOT_AUTHORIZED",
          "Initial": "16",
          "Comment": "Connection to Broker is Refused, because of Not Authorized\naccess"
        },
        {
          "Name": "TOPIC_FILTER_EMPTY",
          "Initial": "17",
          "Comment": "Topic Filter is empty ââ, MUST be at least one character\nlong"
        },
        {
          "Name": "TOPIC_NAME_NOT_ALLOWED_WILDCARD",
          "Initial": "18",
          "Comment": "Topic Name contains Wildcards, what is not allowed. Only\nTopic Filter can contain these"
        },
        {
          "Name": "TOPIC_INVALID_LENGTH",
          "Initial": "19",
          "Comment": "Topic Length out of valid range (valid range: 1 - 1024)"
        },
        {
          "Name": "TOPIC_IS_EMPTY",
          "Initial": "20",
          "Comment": "Topic name is empty"
        },
        {
          "Name": "SUBSCRIBE_FAILURE",
          "Initial": "21",
          "Comment": "Subscription Failure"
        },
        {
          "Name": "ADD_MQTT_PACKET_COLLECTION_ERROR",
          "Initial": "22",
          "Comment": "Collection Error while trying to add a mqtt packet to the\nstack"
        },
        {
          "Name": "ADD_SUBSCRIBER_COLLECTION_ERROR",
          "Initial": "23",
          "Comment": "Collection Error while trying to add a subscriber to the\nstack"
        },
        {
          "Name": "REMOVE_SUBSCRIBER_COLLECTION_ERROR",
          "Initial": "24",
          "Comment": "Collection Error while trying to remove a subscriber from\nthe stack"
        },
        {
          "Name": "ACKNOWLEDGE_TIMEOUT",
          "Initial": "25",
          "Comment": "Client waits for ping response from Server, but Server does\nnot response within a given time interval (2 * ping\ninterval)"
        },
        {
          "Name": "ALLOCATED_PAYLOAD_SIZE_EXCEEDED",
          "Initial": "26",
          "Comment": "The Size of the received payload is more than given\nallocated memory"
        },
        {
          "Name": "MAX_NUMBER_OF_PACKETS_EXCEEDED",
          "Initial": "27",
          "Comment": "The maximum size of packets has been exceeded"
        },
        {
          "Name": "CAN_NOT_ADD_ELEMENT_TO_QUEUE",
          "Initial": "28",
          "Comment": "Can not add the element to queue (maybe the maximum size has\nbeen exceeded)"
        },
        {
          "Name": "QUERYINTERFACE_ERROR",
          "Initial": "29",
          "Comment": "Call of function __QUERYINTERFACE failed (internal error)"
        },
        {
          "Name": "TIME_OUT",
          "Initial": "30",
          "Comment": "Action returned with timeout error."
        },
        {
          "Name": "INVALID_LICENSE",
          "Initial": "31",
          "Comment": "No valid license found or demo mode has expired."
        },
        {
          "Name": "CLIENT_NOT_CONNECTED",
          "Initial": "32",
          "Comment": "The MQTT client is not connected to a broker."
        },
        {
          "Name": "RESOLVE_HOSTNAME_FAILED",
          "Initial": "33",
          "Comment": "The hostname can not be resolved."
        },
        {
          "Name": "MAX_REQUEST_SIZE_EXCEEDED",
          "Initial": "34",
          "Comment": "Size of publish packet packet exceeds the maximum packet\nsize"
        },
        {
          "Name": "UNSUPPORTED_VERSION",
          "Initial": "35",
          "Comment": "Unsupported MQTT version"
        },
        {
          "Name": "OPERATION_NOT_SUCCESSFUL",
          "Initial": "36",
          "Comment": "The operation was not successful. See eReasonCode for more\ninformation. (MQTT V5 only)"
        },
        {
          "Name": "SEND_QUOTA_LIMIT_REACHED",
          "Initial": "37",
          "Comment": "The send quota limit has been reached. Try to publish the\nmessage later."
        },
        {
          "Name": "INVALID_REASON_CODE",
          "Initial": "38",
          "Comment": "The reason code is not allowed in this context."
        },
        {
          "Name": "MAX_RECEIVE_BUFFER_SIZE_EXCEEDED",
          "Initial": "39",
          "Comment": "Size of incoming packets exceeds the maximum size of the\nreceive buffer. See MQTTParam.g_udiMaxReceiveBufferSize"
        },
        {
          "Name": "MAX_TOPIC_LEVEL_EXCEEDED",
          "Initial": "40",
          "Comment": "The maximum topic level has been exceeded."
        },
        {
          "Name": "MAX_STRING_LENGTH_EXCEEDED",
          "Initial": "41",
          "Comment": "The maximum length of a STRING has been exceeded (Maximum\nlength: 1024)."
        },
        {
          "Name": "MAX_CORRELATION_DATA_LENGTH_EXCEEDED",
          "Initial": "42",
          "Comment": "The maximum size of Correlation Data has been exceeded. See\nMQTTParam.g_udiMaxCorrelationDataSize"
        },
        {
          "Name": "MAX_NUMBER_OF_PUBLISHER_AND_SUBSCRIBER_EXCEEDED",
          "Initial": "43",
          "Comment": "The maximum number of publishers and subscribers has been\nexceeded. See MQTTParam.g_udiMaxPublishersAndSubscribers"
        }
      ]
    }
  ]
}