{
  "library": "String Builder Base",
  "title": "ERROR (Enum)",
  "url": "https://content.helpme-codesys.com/en/libs/String Builder Base/Current/BuilderBase/Enums/ERROR.html",
  "page_title": "ERROR (ENUM)",
  "text": "BuilderBase\nAliases\nConstants (GVL)\nIStringRepresentation (Alias)\nRUNE (Alias)\nEnums\nENCODING (Enum)\nERROR (Enum)\nFunction Blocks\nRange (FunctionBlock)\nIRange\nSetInitialValue (Method)\nFunctions\nCreateRange (Function)\nCreateRangePool (Function)\nInterfaces\nIBuilder (Interface)\nGetBuilderStats (Method)\nReset (Method)\nSegments\nWriteIString (Method)\nWriteMemSegment (Method)\nWriteRune (Method)\nWriteString (Method)\nWriteWString (Method)\nICharmap (Interface)\nDecode (Method)\nEncode (Method)\nInternals\n_RangePool (FunctionBlock)\nProtected\nStructs\nSTATS (Struct)\nLibrary Information\nGetLibVersion (Function)\nGetLibVersionNumber (Function)\nIsLibReleased (Function)\nFile and Project Information\nLibrary Reference\nMemory Block Manager\nLibrary Identification\nLibrary Properties\nString Segments\nLibrary Identification\nLibrary Properties\nUTF-8 Encoding Support\nLibrary Identification\nLibrary Properties\nString Builder Base\nDocs\n»\nBuilderBase\n»\nEnums\n»\nERROR (ENUM)\nERROR (ENUM)\nÂ¶\nTYPE ERROR :\nAttributes:\nqualified_only\nInOut:\nName\nInitial\nNO_ERROR\nWRONG_ENCODING\n2\nEND_OF_BUFFER\nWRONG_CONFIGURATION\nWRONG_PARAMETER\nWRONG_USAGE\nINVALID_ENCODING\nNO_MEMORY\nPOOL_EMPTY\nALREADY_INITIALIZED\nWRONG_OPERATION",
  "tables": [
    {
      "headers": [
        "Name",
        "Initial"
      ],
      "rows": [
        {
          "Name": "NO_ERROR",
          "Initial": ""
        },
        {
          "Name": "WRONG_ENCODING",
          "Initial": "2"
        },
        {
          "Name": "END_OF_BUFFER",
          "Initial": ""
        },
        {
          "Name": "WRONG_CONFIGURATION",
          "Initial": ""
        },
        {
          "Name": "WRONG_PARAMETER",
          "Initial": ""
        },
        {
          "Name": "WRONG_USAGE",
          "Initial": ""
        },
        {
          "Name": "INVALID_ENCODING",
          "Initial": ""
        },
        {
          "Name": "NO_MEMORY",
          "Initial": ""
        },
        {
          "Name": "POOL_EMPTY",
          "Initial": ""
        },
        {
          "Name": "ALREADY_INITIALIZED",
          "Initial": ""
        },
        {
          "Name": "WRONG_OPERATION",
          "Initial": ""
        }
      ]
    }
  ]
}