{
  "library": "Standard64",
  "title": "LCTU (FunctionBlock)",
  "url": "https://content.helpme-codesys.com/en/libs/Standard64/Current/Counter/LCTU.html",
  "page_title": "LCTU (FB)",
  "text": "Deutsch\nEnglish\nFrançais\nEspañol\nItaliano\nРусский\n日本語\n中文\nMenu\nSearch\nDeutsch\nEnglish\nFrançais\nEspañol\nItaliano\nРусский\n日本語\n中文\nAtomic Read-Write Functions\nAtomicReadLInt (Function)\nAtomicReadLReal (Function)\nAtomicReadLTime (Function)\nAtomicReadLWord (Function)\nAtomicReadULInt (Function)\nAtomicWriteLInt (Function)\nAtomicWriteLReal (Function)\nAtomicWriteLTime (Function)\nAtomicWriteLWord (Function)\nAtomicWriteULInt (Function)\nCounter\nLCTD (FunctionBlock)\nLCTU (FunctionBlock)\nLCTUD (FunctionBlock)\nString Functions\nWCONCAT (Function)\nWDELETE (Function)\nWFIND (Function)\nWINSERT (Function)\nWLEFT (Function)\nWLEN (Function)\nWMID (Function)\nWREPLACE (Function)\nWRIGHT (Function)\nTimer\nLTOF (FunctionBlock)\nLTON (FunctionBlock)\nLTP (FunctionBlock)\nFile and Project Information\nLibrary Reference\nStandard64\nDocs\n»\nCounter\n»\nLCTU (FB)\nLCTU (FB)\nÂ¶\nFUNCTION_BLOCK PUBLIC LCTU\nIncrements a given value\n(* Example declaration *)\nLCTUInst\n:\nLCTU\n;\n(* Example in ST *)\nLCTUInst\n(\nCU\n:=\nVarBOOL1\n,\nRESET\n:=\nVarBOOL2\n,\nPV\n:=\nVarLWORD1\n);\nVarBOOL3\n:=\nCTUInst.Q\n;\nVarLWORD2\n:=\nCTUInst.CV\n;\nInOut:\nScope\nName\nType\nComment\nInput\nCU\nBOOL\nRising edge: Incrementing\nCV\nby one\nRESET\nBOOL\nTRUE\n: Reset\nCV\nto 0\nPV\nLWORD\nUpper limit for incrementing\nOutput\nQ\nBOOL\nTRUE\nif\nCV\n>=\nPV\nCV\nLWORD\nCurrent counter value\ntop\nCODESYS Group | We\nsoftware\nAutomation.\nto software\n['sɒftwɛər]\ntransitive verb\n__softwared/softwaring\n: to develop software\n// to software automation: to develop software for automation purposes\nThe CODESYS Group is the manufacturer of CODESYS, the leading hardware-independent\n                                    IEC 61131-3 automation software for developing and engineering controller\n                                    applications.\nCODESYS® is a registered trademark.\nCODESYS GmbH\nA member of the CODESYS Group\nMemminger Straße 151, 87439 Kempten\nGermany\nTel.:\n+49-831-54031-0\ninfo@codesys.com\nLegal Notice\nPrivacy Policy\nLinkedIn\nYoutube\nRSS\nDownloads\nLogin\nCODESYS Store\n© 2022 CODESYS GmbH\n| A member of the CODESYS Group",
  "tables": [
    {
      "headers": [
        "Scope",
        "Name",
        "Type",
        "Comment"
      ],
      "rows": [
        {
          "Scope": "Input",
          "Name": "CU",
          "Type": "BOOL",
          "Comment": "Rising edge: IncrementingCVby one"
        },
        [
          "RESET",
          "BOOL",
          "TRUE: ResetCVto 0"
        ],
        [
          "PV",
          "LWORD",
          "Upper limit for incrementing"
        ],
        {
          "Scope": "Output",
          "Name": "Q",
          "Type": "BOOL",
          "Comment": "TRUEifCV>=PV"
        },
        [
          "CV",
          "LWORD",
          "Current counter value"
        ]
      ]
    }
  ]
}