{
  "library": "CommFB",
  "title": "RCVREC_MODE (Enum)",
  "url": "https://content.helpme-codesys.com/en/libs/CommFB/Current/CommFB/FieldDevice/RCVREC_MODE.html",
  "page_title": "RCVREC_MODE (ENUM)",
  "text": "CommFB\nAINFO_TYPE (Union)\nAddressConcept (GVL)\nAddress Concept\nGenerating a CommFB-ID\nProfibus DP\nProfinet IO\nDevice Diagnosis\nAddress Conversion\nAddresses\nADDR_TO_ID (FunctionBlock)\nADDR_TYPE (Union)\nCREATE_ID (FunctionBlock)\nDP_ADDR (Struct)\nDP_DEVICE_ID (Struct)\nID_TO_ADDR (FunctionBlock)\nIO_SYSTEM_TYPE (Enum)\nPN_ADDR (Struct)\nPN_DEVICE_ID (Struct)\nSUBSLOT_ID (Function)\nCNCT (FunctionBlock)\nConstants (GVL)\nDP Address\nADDR (Function)\nID (Function)\nSLOT_ID (Function)\nDP_AINFO (Struct)\nDP_DIAG (Struct)\nErrorCode (Enum)\nErrorCode1_RW (Enum)\nFieldDevice\nPRVREC (FunctionBlock)\nPRVREC_MODE (Enum)\nRCVREC (FunctionBlock)\nRCVREC_MODE (Enum)\nSALARM (FunctionBlock)\nGETIO_PART (FunctionBlock)\nPN_AINFO (Struct)\nRALARM (FunctionBlock)\nRALARM_MODE (Enum)\nRDIAG (FunctionBlock)\nRDREC (FunctionBlock)\nSETIO_PART (FunctionBlock)\nWRREC (FunctionBlock)\nImages\nLibrary Information\nGetLibVersion (Function)\nGetLibVersionNumber (Function)\nIsLibReleased (Function)\nFile and Project Information\nLibrary Reference\nIoDriver Profibus2 Interfaces\nLibrary Identification\nLibrary Properties\nSysMem\nLibrary Identification\nLibrary Properties\nCommFB\nDocs\n»\nCommFB\n»\nFieldDevice\n»\nRCVREC_MODE (ENUM)\nRCVREC_MODE (ENUM)\nÂ¶\nTYPE RCVREC_MODE :\nAttributes:\nqualified_only\nInOut:\nName\nInitial\nComment\nCHECK\n0\nIf the Field Device interface has received a process data record, only the outputs NEW, SLOT, INDEX and RLEN are set.\nMultiple calls of this function block with MODE=0 returns the outputs for the same request.\nRECEIVE\n1\nIf the Field Device interface has received a process data\nrecord, the function block outputs are updated and the data\nrecord is transferred to the RECORD parameter.\nRECEIVE_BY_SLOT\n2\nIf the Field Device interface has received a process data record for the slot or subslot the num-bers of which are given in input F_ID,\nthe function block outputs are updated and the data re-cord is transferred to the RECORD parameter.\nPOS_RESPONSE\n3\nThe service is responded positively.\nNEG_RESPONSE\n4\nAfter checking the request to receive a process data record, this function block refuses to accept this record and sends a negative response to the Host Controller.\nThe error reason is given with the inputs CODE1 and CODE2.",
  "tables": [
    {
      "headers": [
        "Name",
        "Initial",
        "Comment"
      ],
      "rows": [
        {
          "Name": "CHECK",
          "Initial": "0",
          "Comment": "If the Field Device interface has received a process data record, only the outputs NEW, SLOT, INDEX and RLEN are set.\nMultiple calls of this function block with MODE=0 returns the outputs for the same request."
        },
        {
          "Name": "RECEIVE",
          "Initial": "1",
          "Comment": "If the Field Device interface has received a process data\nrecord, the function block outputs are updated and the data\nrecord is transferred to the RECORD parameter."
        },
        {
          "Name": "RECEIVE_BY_SLOT",
          "Initial": "2",
          "Comment": "If the Field Device interface has received a process data record for the slot or subslot the num-bers of which are given in input F_ID,\nthe function block outputs are updated and the data re-cord is transferred to the RECORD parameter."
        },
        {
          "Name": "POS_RESPONSE",
          "Initial": "3",
          "Comment": "The service is responded positively."
        },
        {
          "Name": "NEG_RESPONSE",
          "Initial": "4",
          "Comment": "After checking the request to receive a process data record, this function block refuses to accept this record and sends a negative response to the Host Controller.\nThe error reason is given with the inputs CODE1 and CODE2."
        }
      ]
    }
  ]
}