{
  "library": "CommFB",
  "title": "ADDR_TYPE (Union)",
  "url": "https://content.helpme-codesys.com/en/libs/CommFB/Current/CommFB/Addresses/ADDR_TYPE.html",
  "page_title": "ADDR_TYPE (UNION)",
  "text": "CommFB\nAINFO_TYPE (Union)\nAddressConcept (GVL)\nAddress Concept\nGenerating a CommFB-ID\nProfibus DP\nProfinet IO\nDevice Diagnosis\nAddress Conversion\nAddresses\nADDR_TO_ID (FunctionBlock)\nADDR_TYPE (Union)\nCREATE_ID (FunctionBlock)\nDP_ADDR (Struct)\nDP_DEVICE_ID (Struct)\nID_TO_ADDR (FunctionBlock)\nIO_SYSTEM_TYPE (Enum)\nPN_ADDR (Struct)\nPN_DEVICE_ID (Struct)\nSUBSLOT_ID (Function)\nCNCT (FunctionBlock)\nConstants (GVL)\nDP Address\nADDR (Function)\nID (Function)\nSLOT_ID (Function)\nDP_AINFO (Struct)\nDP_DIAG (Struct)\nErrorCode (Enum)\nErrorCode1_RW (Enum)\nFieldDevice\nPRVREC (FunctionBlock)\nPRVREC_MODE (Enum)\nRCVREC (FunctionBlock)\nRCVREC_MODE (Enum)\nSALARM (FunctionBlock)\nGETIO_PART (FunctionBlock)\nPN_AINFO (Struct)\nRALARM (FunctionBlock)\nRALARM_MODE (Enum)\nRDIAG (FunctionBlock)\nRDREC (FunctionBlock)\nSETIO_PART (FunctionBlock)\nWRREC (FunctionBlock)\nImages\nLibrary Information\nGetLibVersion (Function)\nGetLibVersionNumber (Function)\nIsLibReleased (Function)\nFile and Project Information\nLibrary Reference\nIoDriver Profibus2 Interfaces\nLibrary Identification\nLibrary Properties\nSysMem\nLibrary Identification\nLibrary Properties\nCommFB\nDocs\n»\nCommFB\n»\nAddresses\n»\nADDR_TYPE (UNION)\nADDR_TYPE (UNION)\nÂ¶\nTYPE ADDR_TYPE : UNION\nUniform data structure (UNION) for physical identification of a slot of a PROFIBUS DP-slave or subslot of a PROFINET IO Device.\n(see:\nAddressConcept\n,\nADDR_TO_ID\n,\nID_TO_ADDR\n)\nInOut:\nName\nType\nComment\nSYSTEM\nIO_SYSTEM_TYPE\n1 = DP, 2 = PROFINET IO\nDP\nDP_ADDR\nPN\nPN_ADDR",
  "tables": [
    {
      "headers": [
        "Name",
        "Type",
        "Comment"
      ],
      "rows": [
        {
          "Name": "SYSTEM",
          "Type": "IO_SYSTEM_TYPE",
          "Comment": "1 = DP, 2 = PROFINET IO"
        },
        {
          "Name": "DP",
          "Type": "DP_ADDR",
          "Comment": ""
        },
        {
          "Name": "PN",
          "Type": "PN_ADDR",
          "Comment": ""
        }
      ]
    }
  ]
}