{
  "library": "CommFB",
  "title": "DP_DIAG (Struct)",
  "url": "https://content.helpme-codesys.com/en/libs/CommFB/Current/CommFB/DP_DIAG.html",
  "page_title": "DP_DIAG (STRUCT)",
  "text": "CommFB\nAINFO_TYPE (Union)\nAddressConcept (GVL)\nAddress Concept\nGenerating a CommFB-ID\nProfibus DP\nProfinet IO\nDevice Diagnosis\nAddress Conversion\nAddresses\nADDR_TO_ID (FunctionBlock)\nADDR_TYPE (Union)\nCREATE_ID (FunctionBlock)\nDP_ADDR (Struct)\nDP_DEVICE_ID (Struct)\nID_TO_ADDR (FunctionBlock)\nIO_SYSTEM_TYPE (Enum)\nPN_ADDR (Struct)\nPN_DEVICE_ID (Struct)\nSUBSLOT_ID (Function)\nCNCT (FunctionBlock)\nConstants (GVL)\nDP Address\nADDR (Function)\nID (Function)\nSLOT_ID (Function)\nDP_AINFO (Struct)\nDP_DIAG (Struct)\nErrorCode (Enum)\nErrorCode1_RW (Enum)\nFieldDevice\nPRVREC (FunctionBlock)\nPRVREC_MODE (Enum)\nRCVREC (FunctionBlock)\nRCVREC_MODE (Enum)\nSALARM (FunctionBlock)\nGETIO_PART (FunctionBlock)\nPN_AINFO (Struct)\nRALARM (FunctionBlock)\nRALARM_MODE (Enum)\nRDIAG (FunctionBlock)\nRDREC (FunctionBlock)\nSETIO_PART (FunctionBlock)\nWRREC (FunctionBlock)\nImages\nLibrary Information\nGetLibVersion (Function)\nGetLibVersionNumber (Function)\nIsLibReleased (Function)\nFile and Project Information\nLibrary Reference\nIoDriver Profibus2 Interfaces\nLibrary Identification\nLibrary Properties\nSysMem\nLibrary Identification\nLibrary Properties\nCommFB\nDocs\n»\nCommFB\n»\nDP_DIAG (STRUCT)\nDP_DIAG (STRUCT)\nÂ¶\nTYPE DP_DIAG : STRUCT\nData structure containing DP Slave diagnosis data (see:\nRDIAG\n).\n(see IEC 61158-6)\nInOut:\nName\nType\nComment\nstatus1\nIIoDrvProfibus.DP_StationStatus1\nDP station status 1\nstatus2\nIIoDrvProfibus.DP_StationStatus2\nDP station status 2\nstatus3\nIIoDrvProfibus.DP_StationStatus3\nDP station status 3\nDiag_Master_Add\nUSINT\naddress of the DP-master (Class 1) which has parameterised\nthis DP-slave (255 means invalid or no parameterisation).\nIdent_Number\nUINT\nIdent Number of DP slave\nExtDiag\nARRAY [0..235] OF BYTE\nExtended Diagnosis Data",
  "tables": [
    {
      "headers": [
        "Name",
        "Type",
        "Comment"
      ],
      "rows": [
        {
          "Name": "status1",
          "Type": "IIoDrvProfibus.DP_StationStatus1",
          "Comment": "DP station status 1"
        },
        {
          "Name": "status2",
          "Type": "IIoDrvProfibus.DP_StationStatus2",
          "Comment": "DP station status 2"
        },
        {
          "Name": "status3",
          "Type": "IIoDrvProfibus.DP_StationStatus3",
          "Comment": "DP station status 3"
        },
        {
          "Name": "Diag_Master_Add",
          "Type": "USINT",
          "Comment": "address of the DP-master (Class 1) which has parameterised\nthis DP-slave (255 means invalid or no parameterisation)."
        },
        {
          "Name": "Ident_Number",
          "Type": "UINT",
          "Comment": "Ident Number of DP slave"
        },
        {
          "Name": "ExtDiag",
          "Type": "ARRAY [0..235] OF BYTE",
          "Comment": "Extended Diagnosis Data"
        }
      ]
    }
  ]
}