{
  "library": "DNP3",
  "title": "FreezeTimeDateField (Enum)",
  "url": "https://content.helpme-codesys.com/en/libs/DNP3/Current/DNP3/Function-Blocks/Master/FreezeTimeDateField.html",
  "page_title": "FreezeTimeDateField (ENUM)",
  "text": "DNP3\nDoc\nIntegration of datapoints into the application\nExample\nIntroduction\nCODESYS DNP3 - Components\nOutstation data model and datapoints\nOutstation datapoint - inputs versa configuration\nOutstation datapoint inputs / outputs of type AnyNumber\nOutstation data flow\nMaster functionality\nMaster data flow\nCalling function block instances\nApplication bringup and debugging\nEnums\nCommandRejectReason (Enum)\nDoubleBitState (Enum)\nError (Enum)\nFunction Blocks\nAnyNumberConverter\nAnyNumberToDINT (FunctionBlock)\nAnyNumberToINT (FunctionBlock)\nAnyNumberToLREAL (FunctionBlock)\nAnyNumberToREAL (FunctionBlock)\nAnyNumberToSINT (FunctionBlock)\nAnyNumberToUDINT (FunctionBlock)\nAnyNumberToUINT (FunctionBlock)\nAnyNumberToUSINT (FunctionBlock)\nDINTToAnyNumber (FunctionBlock)\nINTToAnyNumber (FunctionBlock)\nLREALToAnyNumber (FunctionBlock)\nREALToAnyNumber (FunctionBlock)\nSINTToAnyNumber (FunctionBlock)\nUDINTToAnyNumber (FunctionBlock)\nUINTToAnyNumber (FunctionBlock)\nUSINTToAnyNumber (FunctionBlock)\nETHdeviceHelper (FunctionBlock)\nMaster\nAddressQualifier (Enum)\nAnalogInfo (Struct)\nAutoUpdateMode (Enum)\nCROB_Info (Struct)\nCommands\nFreezeTimeDateField (Enum)\nFunctionCode (Enum)\nMaster (FunctionBlock)\nMasterConfiguration (FunctionBlock)\nMasterConfigurationCOM (FunctionBlock)\nMasterConfigurationIP (FunctionBlock)\nMasterLoggingOptions (Enum)\nPointObserver\nTimeSyncType (Enum)\nOutstation\nDNP3OutstationSessionConfigEvents (Struct)\nDNP3OutstationSessionConfigUnsolicitedResponse (Struct)\nEvents\nGroups\nOutstation (FunctionBlock)\nOutstationConfiguration (FunctionBlock)\nOutstationConfigurationCOM (FunctionBlock)\nOutstationConfigurationIP (FunctionBlock)\nOutstationDataModel (FunctionBlock)\nOutstationDataModelExample (FunctionBlock)\nOutstationLoggingOptions (Enum)\nPoints\nFunctions\nAnyNumber\nAnyNumberArithmetic (Function)\nAnyNumberArithmeticOperation (Enum)\nAnyNumberAssign (Function)\nAnyNumberAssignIfNotEqual (Function)\nAnyNumberCheck (Function)\nAnyNumberClipToLimits (Function)\nAnyNumberCompare (Function)\nAnyNumberCompareOperation (Enum)\nAnyNumberConvertFromDINT (Function)\nAnyNumberConvertFromINT (Function)\nAnyNumberConvertFromLREAL (Function)\nAnyNumberConvertFromREAL (Function)\nAnyNumberConvertFromSINT (Function)\nAnyNumberConvertFromUDINT (Function)\nAnyNumberConvertFromUINT (Function)\nAnyNumberConvertFromUSINT (Function)\nAnyNumberConvertToDINT (Function)\nAnyNumberConvertToINT (Function)\nAnyNumberConvertToLREAL (Function)\nAnyNumberConvertToREAL (Function)\nAnyNumberConvertToSINT (Function)\nAnyNumberConvertToUDINT (Function)\nAnyNumberConvertToUINT (Function)\nAnyNumberConvertToUSINT (Function)\nAnyNumberInitToZero (Function)\nAnyNumberIsWithinLimits (Function)\nAnyNumberMaximum (Function)\nAnyNumberMinimum (Function)\nAnyNumberToString (Function)\nAnyNumberTypeEquals (Function)\nAnyNumberTypeToString (Function)\nAnyNumberValueToString (Function)\nAnyNumberZero (Function)\nGetCurrentDateTime (Function)\nGlobalConstants\nConstants (GVL)\nConstantsInternal (GVL)\nInterfaces\nIPoint (Interface)\nGetDescriptionString (Method)\nIdentificationToString (Method)\nPointNum (Property)\nPointTyp (Property)\nToString (Method)\nIPointObserver (Interface)\nEnabled (Property)\nEquals (Method)\nGetError (Method)\nGetErrorId (Method)\nGetSequenceNumber (Method)\nIsModified (Property)\nKey (Property)\nNum (Property)\nToString (Method)\nTyp (Property)\nParameter\nParameter (ParamList)\nTypes\nAnyNumber\nAnyNumber (Struct)\nAnyNumberPointerUnion (Union)\nAnyNumberType (Enum)\nAnyNumberUnion (Union)\nAnyNumberValueUnion (Union)\nCOMParity (Enum)\nCOMStopBits (Enum)\nDNP3_String (Alias)\nLibrary Information\nGetLibVersion (Function)\nGetLibVersionNumber (Function)\nIsLibReleased (Function)\nFile and Project Information\nLibrary Reference\n3SLicense\nLibrary Identification\nLibrary Properties\nCmpApp\nLibrary Identification\nLibrary Properties\nCmpDNP3\nLibrary Identification\nLibrary Properties\nCmpErrors2 Interfaces\nLibrary Identification\nLibrary Properties\nCmpEventMgr\nLibrary Identification\nLibrary Properties\nCmpLog\nLibrary Identification\nLibrary Properties\nComponent Manager\nLibrary Identification\nLibrary Properties\nIoDrvEthernet Interfaces\nLibrary Identification\nLibrary Properties\nIoDrvUtility\nLibrary Identification\nLibrary Properties\nIoStandard\nLibrary Identification\nLibrary Properties\nStandard\nLibrary Identification\nLibrary Properties\nSysCpuHandling\nLibrary Identification\nLibrary Properties\nSysMem\nLibrary Identification\nLibrary Properties\nSysSocket\nLibrary Identification\nLibrary Properties\nSysTask\nLibrary Identification\nLibrary Properties\nSysTimeCore\nLibrary Identification\nLibrary Properties\nSysTimeRtc\nLibrary Identification\nLibrary Properties\nSysTypes2 Interfaces\nLibrary Identification\nLibrary Properties\nUtil\nLibrary Identification\nLibrary Properties\nLibrary Parameter\nDNP3\nDocs\n»\nDNP3\n»\nFunction\nBlocks\n»\nMaster\n»\nFreezeTimeDateField (ENUM)\nFreezeTimeDateField (ENUM)\nÂ¶\nTYPE FreezeTimeDateField :\n|\nââââââââââââââââââââââââââââââââââââ/// |\n| Time-date field /// | Interval field /// | Freeze timing                                                  /// |\n|\nââââââââââââââââââââââââââââââââââââ/// |\n| zero            /// | zero           /// | Freeze once immediately.                                       /// |\n|\nââââââââââââââââââââââââââââââââââââ/// |\n| non-zero        /// | zero           /// | Freeze once at the specified time.                             /// |\n|\nââââââââââââââââââââââââââââââââââââ/// |\n|                 /// |                /// | Periodically freeze at intervals relative to the beginning of  /// |\n| zero            /// | non-zero       /// | of the current hour. Use the time interval from the interval   /// |\n|                 /// |                /// | field. Coninue freezing forever or until a new function code   /// |\n|                 /// |                /// | FREEZE_AT_TIME(_NR) is received.                               /// |\n|\nââââââââââââââââââââââââââââââââââââ/// |\n|                 /// |                /// | Periodically freeze at intervals relative to the time and date /// |\n| non-zero        /// | non-zero       /// | in the time-date field. Use the time interval from the interval/// |\n|                 /// |                /// | field. Coninue freezing forever or until a new function code   /// |\n|                 /// |                /// | FREEZE_AT_TIME(_NR) is received.                               /// |\n|\nââââââââââââââââââââââââââââââââââââ/// |\nNOTE - To cancel a freeze request, set the time-date field to all ones\nThe follow enum is used to enumerate the type of value passed in the time-date field of freeze at time requests.\nAttributes:\nqualified_only\nInOut:\nName\nInitial\nZero\nANY_TO_UDINT(CmpDNP3.IEC_DNPDATA_FREEZE_TIME_DATE_FIELD.DNPDATA_FREEZE_TIME_DATE_FIELD_ZERO)\nNonZero\nANY_TO_UDINT(CmpDNP3.IEC_DNPDATA_FREEZE_TIME_DATE_FIELD.DNPDATA_FREEZE_TIME_DATE_FIELD_NON_ZERO)\nCancel\nANY_TO_UDINT(CmpDNP3.IEC_DNPDATA_FREEZE_TIME_DATE_FIELD.DNPDATA_FREEZE_TIME_DATE_FIELD_CANCEL)",
  "tables": [
    {
      "headers": [
        "Name",
        "Initial"
      ],
      "rows": [
        {
          "Name": "Zero",
          "Initial": "ANY_TO_UDINT(CmpDNP3.IEC_DNPDATA_FREEZE_TIME_DATE_FIELD.DNPDATA_FREEZE_TIME_DATE_FIELD_ZERO)"
        },
        {
          "Name": "NonZero",
          "Initial": "ANY_TO_UDINT(CmpDNP3.IEC_DNPDATA_FREEZE_TIME_DATE_FIELD.DNPDATA_FREEZE_TIME_DATE_FIELD_NON_ZERO)"
        },
        {
          "Name": "Cancel",
          "Initial": "ANY_TO_UDINT(CmpDNP3.IEC_DNPDATA_FREEZE_TIME_DATE_FIELD.DNPDATA_FREEZE_TIME_DATE_FIELD_CANCEL)"
        }
      ]
    }
  ]
}