{
  "library": "MQTT Client SL",
  "title": "MQTT_RETAIN_HANDLING (Enum)",
  "url": "https://content.helpme-codesys.com/en/libs/MQTT Client SL/Current/MQTT-Client/Common/Enums/V5/MQTT_RETAIN_HANDLING.html",
  "page_title": "MQTT_RETAIN_HANDLING (ENUM)",
  "text": "MQTT Client\nCommon\nEnums\nCOMMUNICATION_MODE (Enum)\nFILTER_MODE (Enum)\nMQTT_ERROR (Enum)\nMQTT_QOS (Enum)\nMQTT_VERSION (Enum)\nV5\nFunction Blocks\nMQTTClient (FunctionBlock)\nMQTTPublish (FunctionBlock)\nMQTTSubscribe (FunctionBlock)\nParams\nMQTTParam (ParamList)\nStructs\nMQTTV5\nUTF-8\nConvertUTF16toUTF8 (Function)\nConvertUTF8toUTF16 (Function)\nFile and Project Information\nLibrary Reference\n3SLicense\nLibrary Identification\nLibrary Properties\nCAA FB Factory\nLibrary Identification\nLibrary Properties\nCAA Types Extern\nLibrary Identification\nLibrary Properties\nCmpCrypto\nLibrary Identification\nLibrary Properties\nCmpErrors2 Interfaces\nLibrary Identification\nLibrary Properties\nCmpLog\nLibrary Identification\nLibrary Properties\nCmpSchedule\nLibrary Identification\nLibrary Properties\nCmpX509Cert\nLibrary Identification\nLibrary Properties\nCommon Behaviour Model\nLibrary Identification\nLibrary Properties\nComponent Manager\nLibrary Identification\nLibrary Properties\nElement Collections\nLibrary Identification\nLibrary Properties\nMemoryUtils\nLibrary Identification\nLibrary Properties\nNet Base Services\nLibrary Identification\nLibrary Properties\nStandard\nLibrary Identification\nLibrary Properties\nStringUtils\nLibrary Identification\nLibrary Properties\nSysMem\nLibrary Identification\nLibrary Properties\nSysSocket2\nLibrary Identification\nLibrary Properties\nSysSocket2 Implementation\nLibrary Identification\nLibrary Properties\nSysTime\nLibrary Identification\nLibrary Properties\nSysTypes2 Interfaces\nLibrary Identification\nLibrary Properties\nWeb Socket Client SL\nLibrary Identification\nLibrary Properties\nMQTT Client SL\nDocs\n»\nMQTT\nClient\n»\nCommon\n»\nEnums\n»\nV5\n»\nMQTT_RETAIN_HANDLING (ENUM)\nMQTT_RETAIN_HANDLING (ENUM)\nÂ¶\nTYPE MQTT_RETAIN_HANDLING :\nEnum for the Retain Handling option.\nThis option specifies whether retained messages are sent when the subscription is established\nAttributes:\nqualified_only\nInOut:\nName\nInitial\nComment\nTime_Of_Subscribe\n0\nNot_Exists\n1\nSend retained messages at the time of the subscribe\nDo_Not_Send\n2\nSend retained messages at subscribe only if the subscription does not currently exist\nDo not send retained messages at the time of the subscribe",
  "tables": [
    {
      "headers": [
        "Name",
        "Initial",
        "Comment"
      ],
      "rows": [
        {
          "Name": "Time_Of_Subscribe",
          "Initial": "0",
          "Comment": ""
        },
        {
          "Name": "Not_Exists",
          "Initial": "1",
          "Comment": "Send retained messages at the time of the subscribe"
        },
        {
          "Name": "Do_Not_Send",
          "Initial": "2",
          "Comment": "Send retained messages at subscribe only if the subscription does not currently exist\nDo not send retained messages at the time of the subscribe"
        }
      ]
    }
  ]
}