{
  "library": "MQTT Client SL",
  "title": "MQTTAuthProperties (Struct)",
  "url": "https://content.helpme-codesys.com/en/libs/MQTT Client SL/Current/MQTT-Client/Common/Structs/MQTTV5/Properties/MQTTAuthProperties.html",
  "page_title": "MQTTAuthProperties (STRUCT)",
  "text": "MQTT Client\nCommon\nEnums\nCOMMUNICATION_MODE (Enum)\nFILTER_MODE (Enum)\nMQTT_ERROR (Enum)\nMQTT_QOS (Enum)\nMQTT_VERSION (Enum)\nV5\nFunction Blocks\nMQTTClient (FunctionBlock)\nMQTTPublish (FunctionBlock)\nMQTTSubscribe (FunctionBlock)\nParams\nMQTTParam (ParamList)\nStructs\nMQTTV5\nUTF-8\nConvertUTF16toUTF8 (Function)\nConvertUTF8toUTF16 (Function)\nFile and Project Information\nLibrary Reference\n3SLicense\nLibrary Identification\nLibrary Properties\nCAA FB Factory\nLibrary Identification\nLibrary Properties\nCAA Types Extern\nLibrary Identification\nLibrary Properties\nCmpCrypto\nLibrary Identification\nLibrary Properties\nCmpErrors2 Interfaces\nLibrary Identification\nLibrary Properties\nCmpLog\nLibrary Identification\nLibrary Properties\nCmpSchedule\nLibrary Identification\nLibrary Properties\nCmpX509Cert\nLibrary Identification\nLibrary Properties\nCommon Behaviour Model\nLibrary Identification\nLibrary Properties\nComponent Manager\nLibrary Identification\nLibrary Properties\nElement Collections\nLibrary Identification\nLibrary Properties\nMemoryUtils\nLibrary Identification\nLibrary Properties\nNet Base Services\nLibrary Identification\nLibrary Properties\nStandard\nLibrary Identification\nLibrary Properties\nStringUtils\nLibrary Identification\nLibrary Properties\nSysMem\nLibrary Identification\nLibrary Properties\nSysSocket2\nLibrary Identification\nLibrary Properties\nSysSocket2 Implementation\nLibrary Identification\nLibrary Properties\nSysTime\nLibrary Identification\nLibrary Properties\nSysTypes2 Interfaces\nLibrary Identification\nLibrary Properties\nWeb Socket Client SL\nLibrary Identification\nLibrary Properties\nMQTT Client SL\nDocs\n»\nMQTT\nClient\n»\nCommon\n»\nStructs\n»\nMQTTV5\n»\nProperties\n»\nMQTTAuthProperties (STRUCT)\nMQTTAuthProperties (STRUCT)\nÂ¶\nTYPE MQTTAuthProperties : STRUCT\nAuth properties (MQTT V5)\nMQTTAuthProperties can be send to the server via the method MQTTClient.SendAuth().\nThe content of pbAuthenticationData depends on the authentication method.\nInOut:\nName\nType\nComment\nwsAuthenticationMethod\nWSTRING\nName of the authentication method\npbAuthenticationData\nPOINTER TO BYTE\nBinary Data containing authentication data\nudiAuthenticationDataSize\nUDINT\nSize of pbAuthenticationData\nuserProperties\nARRAY\n[0..(MQTTParam.g_udiMaxUserProperties\n- 1)] OF\nMQTTStringPair\nUser defined properties",
  "tables": [
    {
      "headers": [
        "Name",
        "Type",
        "Comment"
      ],
      "rows": [
        {
          "Name": "wsAuthenticationMethod",
          "Type": "WSTRING",
          "Comment": "Name of the authentication method"
        },
        {
          "Name": "pbAuthenticationData",
          "Type": "POINTER TO BYTE",
          "Comment": "Binary Data containing authentication data"
        },
        {
          "Name": "udiAuthenticationDataSize",
          "Type": "UDINT",
          "Comment": "Size of pbAuthenticationData"
        },
        {
          "Name": "userProperties",
          "Type": "ARRAY\n[0..(MQTTParam.g_udiMaxUserProperties\n- 1)] OFMQTTStringPair",
          "Comment": "User defined properties"
        }
      ]
    }
  ]
}