{
  "library": "Standard",
  "title": "CTUD (FunctionBlock)",
  "url": "https://content.helpme-codesys.com/en/libs/Standard/Current/Counter/CTUD.html",
  "page_title": "CTUD (FB)",
  "text": "Deutsch\nEnglish\nFrançais\nEspañol\nItaliano\nРусский\n日本語\n中文\nMenu\nSearch\nDeutsch\nEnglish\nFrançais\nEspañol\nItaliano\nРусский\n日本語\n中文\nBistable Function Blocks\nRS (FunctionBlock)\nSR (FunctionBlock)\nCounter\nCTD (FunctionBlock)\nCTU (FunctionBlock)\nCTUD (FunctionBlock)\nMiscellaneous\nRTC (FunctionBlock)\nString Functions\nCONCAT (Function)\nDELETE (Function)\nFIND (Function)\nINSERT (Function)\nLEFT (Function)\nLEN (Function)\nMID (Function)\nREPLACE (Function)\nRIGHT (Function)\nTimer\nTOF (FunctionBlock)\nTON (FunctionBlock)\nTP (FunctionBlock)\nTrigger\nF_TRIG (FunctionBlock)\nR_TRIG (FunctionBlock)\nFile and Project Information\nLibrary Reference\nStandard\nDocs\n»\nCounter\n»\nCTUD (FB)\nCTUD (FB)\nÂ¶\nFUNCTION_BLOCK CTUD\nIncrements and decrements a given value\nNote\nDatatype\nWORD\n, which is used for\nPV\nin CODESYS, does not match the IEC standard, which for\nPV\ndefines datatype\nINT\n.\n(* Example declaration *)\nCTUDInst\n:\nCUTD\n;\n(* Example in ST *)\nCTUDInst\n(\nCU\n:=\nVarBOOL1\n,\nCD\n:=\nVarBOOL2\n,\nRESET\n:=\nVarBOOL3\n,\nLOAD\n:=\nVarBOOL4\n,\nPV\n:=\nVarWORD1\n);\nVarBOOL5\n:=\nCTUDInst.QU\n;\nVarBOOL6\n:=\nCTUDInst.QD\n;\nVarWORD2\n:=\nCTUDInst.CV\n;\nInOut:\nScope\nName\nType\nComment\nInput\nCU\nBOOL\nRising edge: Incrementing\nCV\nby one\nCD\nBOOL\nRising edge: Decrementing\nCV\nby one\nRESET\nBOOL\nTRUE\n: Reset\nCV\nto 0\nLOAD\nBOOL\nTRUE\n: Set\nCV\nto the start value\nPV\nPV\nWORD\nStart value for decrementing / upper limit for incrementing\nOutput\nQU\nBOOL\nTRUE\nif\nCV\n>=\nPV\nQD\nBOOL\nTRUE\nif\nCV\n=\n0\nCV\nWORD\nCurrent counter value\ntop\nCODESYS Group | We\nsoftware\nAutomation.\nto software\n['sɒftwɛər]\ntransitive verb\n__softwared/softwaring\n: to develop software\n// to software automation: to develop software for automation purposes\nThe CODESYS Group is the manufacturer of CODESYS, the leading hardware-independent\n                                    IEC 61131-3 automation software for developing and engineering controller\n                                    applications.\nCODESYS® is a registered trademark.\nCODESYS GmbH\nA member of the CODESYS Group\nMemminger Straße 151, 87439 Kempten\nGermany\nTel.:\n+49-831-54031-0\ninfo@codesys.com\nLegal Notice\nPrivacy Policy\nLinkedIn\nYoutube\nRSS\nDownloads\nLogin\nCODESYS Store\n© 2022 CODESYS GmbH\n| A member of the CODESYS Group",
  "tables": [
    {
      "headers": [
        "Scope",
        "Name",
        "Type",
        "Comment"
      ],
      "rows": [
        {
          "Scope": "Input",
          "Name": "CU",
          "Type": "BOOL",
          "Comment": "Rising edge: IncrementingCVby one"
        },
        [
          "CD",
          "BOOL",
          "Rising edge: DecrementingCVby one"
        ],
        [
          "RESET",
          "BOOL",
          "TRUE: ResetCVto 0"
        ],
        [
          "LOAD",
          "BOOL",
          "TRUE: SetCVto the start valuePV"
        ],
        [
          "PV",
          "WORD",
          "Start value for decrementing / upper limit for incrementing"
        ],
        {
          "Scope": "Output",
          "Name": "QU",
          "Type": "BOOL",
          "Comment": "TRUEifCV>=PV"
        },
        [
          "QD",
          "BOOL",
          "TRUEifCV=0"
        ],
        [
          "CV",
          "WORD",
          "Current counter value"
        ]
      ]
    }
  ]
}