{
  "library": "Standard",
  "title": "TON (FunctionBlock)",
  "url": "https://content.helpme-codesys.com/en/libs/Standard/Current/Timer/TON.html",
  "page_title": "TON (FB)",
  "text": "Deutsch\nEnglish\nFrançais\nEspañol\nItaliano\nРусский\n日本語\n中文\nMenu\nSearch\nDeutsch\nEnglish\nFrançais\nEspañol\nItaliano\nРусский\n日本語\n中文\nBistable Function Blocks\nRS (FunctionBlock)\nSR (FunctionBlock)\nCounter\nCTD (FunctionBlock)\nCTU (FunctionBlock)\nCTUD (FunctionBlock)\nMiscellaneous\nRTC (FunctionBlock)\nString Functions\nCONCAT (Function)\nDELETE (Function)\nFIND (Function)\nINSERT (Function)\nLEFT (Function)\nLEN (Function)\nMID (Function)\nREPLACE (Function)\nRIGHT (Function)\nTimer\nTOF (FunctionBlock)\nTON (FunctionBlock)\nTP (FunctionBlock)\nTrigger\nF_TRIG (FunctionBlock)\nR_TRIG (FunctionBlock)\nFile and Project Information\nLibrary Reference\nStandard\nDocs\n»\nTimer\n»\nTON (FB)\nTON (FB)\nÂ¶\nFUNCTION_BLOCK TON\nImplements a timer with a turn-on delay\n(* Example declaration *)\nTONInst\n:\nTON\n;\n(* Example in ST *)\nTONInst\n(\nIN\n:=\nVarBOOL1\n,\nPT\n:=\nT#5s\n);\nVarBOOL2\n:=\nTONInst.Q\n;\nInOut:\nScope\nName\nType\nComment\nInput\nIN\nBOOL\nRising edge: starts delay counter\nFalling edge: resets delay counter\nPT\nTIME\nTime for the delay counter [ms]\nOutput\nQ\nBOOL\nFALSE\nif\nIN\nis\nFALSE\nTRUE\nif\nIN\nis\nTRUE\nand delay time\nPT\nelapsed\nET\nTIME\nElapsed time since rising edge at\nIN\ntop\nCODESYS Group | We\nsoftware\nAutomation.\nto software\n['sɒftwɛər]\ntransitive verb\n__softwared/softwaring\n: to develop software\n// to software automation: to develop software for automation purposes\nThe CODESYS Group is the manufacturer of CODESYS, the leading hardware-independent\n                                    IEC 61131-3 automation software for developing and engineering controller\n                                    applications.\nCODESYS® is a registered trademark.\nCODESYS GmbH\nA member of the CODESYS Group\nMemminger Straße 151, 87439 Kempten\nGermany\nTel.:\n+49-831-54031-0\ninfo@codesys.com\nLegal Notice\nPrivacy Policy\nLinkedIn\nYoutube\nRSS\nDownloads\nLogin\nCODESYS Store\n© 2022 CODESYS GmbH\n| A member of the CODESYS Group",
  "tables": [
    {
      "headers": [
        "Scope",
        "Name",
        "Type",
        "Comment"
      ],
      "rows": [
        {
          "Scope": "Input",
          "Name": "IN",
          "Type": "BOOL",
          "Comment": "Rising edge: starts delay counterFalling edge: resets delay counter"
        },
        [
          "PT",
          "TIME",
          "Time for the delay counter [ms]"
        ],
        {
          "Scope": "Output",
          "Name": "Q",
          "Type": "BOOL",
          "Comment": "FALSEifINisFALSETRUEifINisTRUEand delay timePTelapsed"
        },
        [
          "ET",
          "TIME",
          "Elapsed time since rising edge atIN"
        ]
      ]
    }
  ]
}