{
  "library": "String Builder Base",
  "title": "GetLibVersionNumber (Function)",
  "url": "https://content.helpme-codesys.com/en/libs/String Builder Base/Current/Library-Information/GetLibVersionNumber.html",
  "page_title": "GetLibVersionNumber (FUN)",
  "text": "BuilderBase\nAliases\nConstants (GVL)\nIStringRepresentation (Alias)\nRUNE (Alias)\nEnums\nENCODING (Enum)\nERROR (Enum)\nFunction Blocks\nRange (FunctionBlock)\nIRange\nSetInitialValue (Method)\nFunctions\nCreateRange (Function)\nCreateRangePool (Function)\nInterfaces\nIBuilder (Interface)\nGetBuilderStats (Method)\nReset (Method)\nSegments\nWriteIString (Method)\nWriteMemSegment (Method)\nWriteRune (Method)\nWriteString (Method)\nWriteWString (Method)\nICharmap (Interface)\nDecode (Method)\nEncode (Method)\nInternals\n_RangePool (FunctionBlock)\nProtected\nStructs\nSTATS (Struct)\nLibrary Information\nGetLibVersion (Function)\nGetLibVersionNumber (Function)\nIsLibReleased (Function)\nFile and Project Information\nLibrary Reference\nMemory Block Manager\nLibrary Identification\nLibrary Properties\nString Segments\nLibrary Identification\nLibrary Properties\nUTF-8 Encoding Support\nLibrary Identification\nLibrary Properties\nString Builder Base\nDocs\n»\nLibrary\nInformation\n»\nGetLibVersionNumber (FUN)\nGetLibVersionNumber (FUN)\nÂ¶\nFUNCTION GetLibVersionNumber : DWORD\nInOut:\nScope\nName\nType\nReturn\nGetLibVersionNumber\nDWORD",
  "tables": [
    {
      "headers": [
        "Scope",
        "Name",
        "Type"
      ],
      "rows": [
        {
          "Scope": "Return",
          "Name": "GetLibVersionNumber",
          "Type": "DWORD"
        }
      ]
    }
  ]
}