{
  "library": "String Builder Base",
  "title": "ENCODING (Enum)",
  "url": "https://content.helpme-codesys.com/en/libs/String Builder Base/Current/BuilderBase/Enums/ENCODING.html",
  "page_title": "ENCODING (ENUM)",
  "text": "BuilderBase\nAliases\nConstants (GVL)\nIStringRepresentation (Alias)\nRUNE (Alias)\nEnums\nENCODING (Enum)\nERROR (Enum)\nFunction Blocks\nRange (FunctionBlock)\nIRange\nSetInitialValue (Method)\nFunctions\nCreateRange (Function)\nCreateRangePool (Function)\nInterfaces\nIBuilder (Interface)\nGetBuilderStats (Method)\nReset (Method)\nSegments\nWriteIString (Method)\nWriteMemSegment (Method)\nWriteRune (Method)\nWriteString (Method)\nWriteWString (Method)\nICharmap (Interface)\nDecode (Method)\nEncode (Method)\nInternals\n_RangePool (FunctionBlock)\nProtected\nStructs\nSTATS (Struct)\nLibrary Information\nGetLibVersion (Function)\nGetLibVersionNumber (Function)\nIsLibReleased (Function)\nFile and Project Information\nLibrary Reference\nMemory Block Manager\nLibrary Identification\nLibrary Properties\nString Segments\nLibrary Identification\nLibrary Properties\nUTF-8 Encoding Support\nLibrary Identification\nLibrary Properties\nString Builder Base\nDocs\n»\nBuilderBase\n»\nEnums\n»\nENCODING (ENUM)\nENCODING (ENUM)\nÂ¶\nTYPE ENCODING :\nAttributes:\nqualified_only\nInOut:\nName\nComment\nUNKNOWN\nUTF8\nUTF-8 Encoding\nUTF16\nUTF-16 Encoding (host byte order)\nUTF16BE\nUTF-16 Encoding (big endian byte order)\nUTF16LE\nUTF-16 Encoding (little endian byte order)",
  "tables": [
    {
      "headers": [
        "Name",
        "Comment"
      ],
      "rows": [
        {
          "Name": "UNKNOWN",
          "Comment": ""
        },
        {
          "Name": "UTF8",
          "Comment": "UTF-8 Encoding"
        },
        {
          "Name": "UTF16",
          "Comment": "UTF-16 Encoding (host byte order)"
        },
        {
          "Name": "UTF16BE",
          "Comment": "UTF-16 Encoding (big endian byte order)"
        },
        {
          "Name": "UTF16LE",
          "Comment": "UTF-16 Encoding (little endian byte order)"
        }
      ]
    }
  ]
}