{
  "library": "String Segments",
  "title": "CONFIG (Struct)",
  "url": "https://content.helpme-codesys.com/en/libs/String Segments/Current/Strings/Structs/CONFIG.html",
  "page_title": "CONFIG (STRUCT)",
  "text": "Library Information\nGetLibVersion (Function)\nGetLibVersionNumber (Function)\nIsLibReleased (Function)\nStrings\nAliases\nConstants (GVL)\nIDisposable (Alias)\nRUNE (Alias)\nEnums\nERROR (Enum)\nFunctionblocks\nRange (FunctionBlock)\nIRange\nSetInitialValue (Method)\nUTF8Literal (FunctionBlock)\nSetInitialValue (Method)\n_RangePool (FunctionBlock)\nProtected\n_StringPool (FunctionBlock)\nIStringPool\nSetInitialValue (Method)\n_UTF8String (FunctionBlock)\nIString\nIStringRepresentation\nFunctions\nCompare (Function)\nCopy (Function)\nCreateRangePool (Function)\nCreateString (Function)\nCreateStringPool (Function)\nIsASCIIString (Function)\nIsValidString (Function)\nLen (Function)\nReset (Function)\nRuneCount (Function)\nSetSegment (Function)\nInterfaces\nIRange (Interface)\nGetNextRune (Method)\nReset (Method)\nUngetLastRune (Method)\nIRangePool (Interface)\nGetPoolStatus (Method)\nGetRange (Method)\nIRangeProvider (Interface)\nGetRange (Method)\nIString (Interface)\nGetSegment (Method)\nIsASCII (Method)\nIsValid (Method)\nLen (Method)\nIStringPool (Interface)\nGetPoolConfig (Method)\nGetString (Method)\nIStringRepresentation (Interface)\nLen (Method)\nToIString (Method)\nStructs\nCONFIG (Struct)\nSTATUS (Struct)\nFile and Project Information\nLibrary Reference\nMemory Block Manager\nLibrary Identification\nLibrary Properties\nSysMem\nLibrary Identification\nLibrary Properties\nUTF-8 Encoding Support\nLibrary Identification\nLibrary Properties\nString Segments\nDocs\n»\nStrings\n»\nStructs\n»\nCONFIG (STRUCT)\nCONFIG (STRUCT)\nÂ¶\nTYPE CONFIG : STRUCT\nThe current status of a\nIStringPool\ninstance\nInOut:\nName\nType\nudiStringSize\nUDINT\nudiCapacity\nUDINT\nudiStringsLeft\nUDINT",
  "tables": [
    {
      "headers": [
        "Name",
        "Type"
      ],
      "rows": [
        {
          "Name": "udiStringSize",
          "Type": "UDINT"
        },
        {
          "Name": "udiCapacity",
          "Type": "UDINT"
        },
        {
          "Name": "udiStringsLeft",
          "Type": "UDINT"
        }
      ]
    }
  ]
}