{
  "library": "String Functions",
  "title": "GetLibVersion (Function)",
  "url": "https://content.helpme-codesys.com/en/libs/String Functions/Current/Library-Information/GetLibVersion.html",
  "page_title": "GetLibVersion (FUN)",
  "text": "Library Information\nGetLibVersion (Function)\nGetLibVersionNumber (Function)\nIsLibReleased (Function)\nStrFunc\nAliases\nIString (Alias)\nEnums\nERROR (Enum)\nFunctions\nCONCAT (Function)\nCOUNT (Function)\nDELETE (Function)\nFIND (Function)\nINSERT (Function)\nLEFT (Function)\nLEN (Function)\nMID (Function)\nREPLACE (Function)\nRIGHT (Function)\nFile and Project Information\nLibrary Reference\nString Segments\nLibrary Identification\nLibrary Properties\nSysMem\nLibrary Identification\nLibrary Properties\nUTF-8 Encoding Support\nLibrary Identification\nLibrary Properties\nString Functions\nDocs\n»\nLibrary\nInformation\n»\nGetLibVersion (FUN)\nGetLibVersion (FUN)\nÂ¶\nFUNCTION GetLibVersion : VERSION\nInOut:\nScope\nName\nType\nReturn\nGetLibVersion\nVERSION",
  "tables": [
    {
      "headers": [
        "Scope",
        "Name",
        "Type"
      ],
      "rows": [
        {
          "Scope": "Return",
          "Name": "GetLibVersion",
          "Type": "VERSION"
        }
      ]
    }
  ]
}