{
  "library": "String Builder",
  "title": "IsLibReleased (Function)",
  "url": "https://content.helpme-codesys.com/en/libs/String Builder/Current/Library-Information/IsLibReleased.html",
  "page_title": "IsLibReleased (FUN)",
  "text": "Builder\nAliases\nConstants (GVL)\nEnums\nENCODING (Alias)\nERROR (Alias)\nSTATS (Alias)\nFunction Blocks\nRange (Alias)\n_RangePool (Alias)\nInterfaces\nIBuilder (Folder)\nICharmap (Alias)\nIString (Alias)\nIStringRepresentation (Folder)\nTypes\nRUNE (Alias)\nFunction Blocks\n_Builder (FunctionBlock)\nIBuilder\nIStringRepresentation\nSetInitialValue (Method)\nFunctions\nCreateRange (Function)\nCreateRangePool (Function)\nLibrary Information\nGetLibVersion (Function)\nGetLibVersionNumber (Function)\nIsLibReleased (Function)\nFile and Project Information\nLibrary Reference\nImmutable String Segments\nLibrary Identification\nLibrary Properties\nMemory Block Manager\nLibrary Identification\nLibrary Properties\nString Builder Base\nLibrary Identification\nLibrary Properties\nString Conversions\nLibrary Identification\nLibrary Properties\nSysMem\nLibrary Identification\nLibrary Properties\nUTF-16 Encoding Support\nLibrary Identification\nLibrary Properties\nUTF-8 Encoding Support\nLibrary Identification\nLibrary Properties\nString Builder\nDocs\n»\nLibrary\nInformation\n»\nIsLibReleased (FUN)\nIsLibReleased (FUN)\nÂ¶\nFUNCTION IsLibReleased : BOOL\nInOut:\nScope\nName\nType\nReturn\nIsLibReleased\nBOOL",
  "tables": [
    {
      "headers": [
        "Scope",
        "Name",
        "Type"
      ],
      "rows": [
        {
          "Scope": "Return",
          "Name": "IsLibReleased",
          "Type": "BOOL"
        }
      ]
    }
  ]
}