{
  "library": "String Builder Base",
  "title": "STATS (Struct)",
  "url": "https://content.helpme-codesys.com/en/libs/String Builder Base/Current/BuilderBase/Structs/STATS.html",
  "page_title": "STATS (STRUCT)",
  "text": "BuilderBase\nAliases\nConstants (GVL)\nIStringRepresentation (Alias)\nRUNE (Alias)\nEnums\nENCODING (Enum)\nERROR (Enum)\nFunction Blocks\nRange (FunctionBlock)\nIRange\nSetInitialValue (Method)\nFunctions\nCreateRange (Function)\nCreateRangePool (Function)\nInterfaces\nIBuilder (Interface)\nGetBuilderStats (Method)\nReset (Method)\nSegments\nWriteIString (Method)\nWriteMemSegment (Method)\nWriteRune (Method)\nWriteString (Method)\nWriteWString (Method)\nICharmap (Interface)\nDecode (Method)\nEncode (Method)\nInternals\n_RangePool (FunctionBlock)\nProtected\nStructs\nSTATS (Struct)\nLibrary Information\nGetLibVersion (Function)\nGetLibVersionNumber (Function)\nIsLibReleased (Function)\nFile and Project Information\nLibrary Reference\nMemory Block Manager\nLibrary Identification\nLibrary Properties\nString Segments\nLibrary Identification\nLibrary Properties\nUTF-8 Encoding Support\nLibrary Identification\nLibrary Properties\nString Builder Base\nDocs\n»\nBuilderBase\n»\nStructs\n»\nSTATS (STRUCT)\nSTATS (STRUCT)\nÂ¶\nTYPE STATS : STRUCT\nInOut:\nName\nType\nComment\nudiLength\nUDINT\nnumber of bytes\nudiRuneCount\nUDINT\nnumber of runes\nudiSegmentSize\nUDINT\nudiCapacity\nUDINT\nudiBytesLeft\nUDINT\nxASCII\nBOOL",
  "tables": [
    {
      "headers": [
        "Name",
        "Type",
        "Comment"
      ],
      "rows": [
        {
          "Name": "udiLength",
          "Type": "UDINT",
          "Comment": "number of bytes"
        },
        {
          "Name": "udiRuneCount",
          "Type": "UDINT",
          "Comment": "number of runes"
        },
        {
          "Name": "udiSegmentSize",
          "Type": "UDINT",
          "Comment": ""
        },
        {
          "Name": "udiCapacity",
          "Type": "UDINT",
          "Comment": ""
        },
        {
          "Name": "udiBytesLeft",
          "Type": "UDINT",
          "Comment": ""
        },
        {
          "Name": "xASCII",
          "Type": "BOOL",
          "Comment": ""
        }
      ]
    }
  ]
}