{
  "library": "SysDir",
  "title": "DirInfo (Struct)",
  "url": "https://content.helpme-codesys.com/en/libs/SysDir/Current/DirInfo.html",
  "page_title": "DirInfo (STRUCT)",
  "text": "Deutsch\nEnglish\nFrançais\nEspañol\nItaliano\nРусский\n日本語\n中文\nMenu\nSearch\nDeutsch\nEnglish\nFrançais\nEspañol\nItaliano\nРусский\n日本語\n中文\nDirFileTime (Struct)\nDirInfo (Struct)\nDirInfoFlags (GVL)\nSysDirClose (Function)\nSysDirCopy (Function)\nSysDirCreate (Function)\nSysDirCreate2 (Function)\nSysDirDelete (Function)\nSysDirDelete2 (Function)\nSysDirGetCurrent (Function)\nSysDirOpen (Function)\nSysDirRead (Function)\nSysDirRename (Function)\nSysDirSetCurrent (Function)\nFile and Project Information\nLibrary Reference\nCmpErrors2 Interfaces\nLibrary Identification\nLibrary Properties\nSysTypes2 Interfaces\nLibrary Identification\nLibrary Properties\nSysDir\nDocs\n»\nDirInfo (STRUCT)\nDirInfo (STRUCT)\nÂ¶\nTYPE DirInfo : STRUCT\nDirectory info entry\nThis structure contains the description of one directory entry\nInOut:\nName\nType\nComment\ntDirFileTime\nDirFileTime\nDirectory dates\nulSize\n__XWORD\nSize of the directory\ndiDirectory\nDINT\nFlag of a directory. See DirInfoFlags\ntop\nCODESYS Group | We\nsoftware\nAutomation.\nto software\n['sɒftwɛər]\ntransitive verb\n__softwared/softwaring\n: to develop software\n// to software automation: to develop software for automation purposes\nThe CODESYS Group is the manufacturer of CODESYS, the leading hardware-independent\n                                    IEC 61131-3 automation software for developing and engineering controller\n                                    applications.\nCODESYS® is a registered trademark.\nCODESYS GmbH\nA member of the CODESYS Group\nMemminger Straße 151, 87439 Kempten\nGermany\nTel.:\n+49-831-54031-0\ninfo@codesys.com\nLegal Notice\nPrivacy Policy\nLinkedIn\nYoutube\nRSS\nDownloads\nLogin\nCODESYS Store\n© 2022 CODESYS GmbH\n| A member of the CODESYS Group",
  "tables": [
    {
      "headers": [
        "Name",
        "Type",
        "Comment"
      ],
      "rows": [
        {
          "Name": "tDirFileTime",
          "Type": "DirFileTime",
          "Comment": "Directory dates"
        },
        {
          "Name": "ulSize",
          "Type": "__XWORD",
          "Comment": "Size of the directory"
        },
        {
          "Name": "diDirectory",
          "Type": "DINT",
          "Comment": "Flag of a directory. See DirInfoFlags"
        }
      ]
    }
  ]
}