{
  "library": "Visu Utils",
  "title": "ERROR (Enum)",
  "url": "https://content.helpme-codesys.com/en/libs/Visu Utils/Current/VisuUtils/VisuActionUtilities/Types/Enum/ERROR.html",
  "page_title": "ERROR (ENUM)",
  "text": "VisuUtils\nVisuActionUtilities\nFunction Blocks\nFBFileTransfer (FunctionBlock)\nFbChangeVisu (FunctionBlock)\nFbCloseDialog (FunctionBlock)\nFbIterateClients (FunctionBlock)\nFbOpenDialog (FunctionBlock)\nFbOpenDialogExtended (FunctionBlock)\nFunctions\nFctGetNextVisu (Function)\nFctGetPreviousVisu (Function)\nFctHandleEventsWithinCycleStart (Function)\nFctHandleEventsWithinCycleStop (Function)\nGlobalVariables\nGlobals (GVL)\nPublicVariables (GVL)\nInterfaces\nIVisualizationClient (Interface)\nIVisualizationClientFilter (Interface)\nIVisualizationClientIteration (Interface)\nIVisualizationClientRaw (Interface)\nTypes\nEnum\nFile and Project Information\nLibrary Reference\nCmpIecTask\nLibrary Identification\nLibrary Properties\nCmpVisuHandler\nLibrary Identification\nLibrary Properties\nCommon Behaviour Model\nLibrary Identification\nLibrary Properties\nSysMem\nLibrary Identification\nLibrary Properties\nSysSem\nLibrary Identification\nLibrary Properties\nSysTypes2 Interfaces\nLibrary Identification\nLibrary Properties\nVisuElemBase\nLibrary Identification\nLibrary Properties\nVisu Utils\nDocs\n»\nVisuUtils\n»\nVisuActionUtilities\n»\nTypes\n»\nEnum\n»\nERROR (ENUM)\nERROR (ENUM)\nÂ¶\nTYPE ERROR :\nErrors that might be returned by functionblocks from this library typically\nusing the variable eError.\nAttributes:\nqualified_only\nInOut:\nName\nComment\nNO_ERROR\nTIME_OUT\nNOT_CALLED_FROM_VISU\nNOT_SUPPORTED_FOR_INTEGRATED_VISU\nERROR\nTRANSFER_CANCELLED\nTRANSER_IN_PROGRESS\nTRANSFER_FAILED\nFILE_READ_ERROR\nVISU_NOT_FOUND\nNo visualization with the given name found.\nNO_CLIENT_FILTER\nNo clientFilter (e.g. as\nFbExecuteSingleVisuActionBase.clientFilter\n) was set so\nthe action cannot be executed at all.\nNO_ITERATION_CALLBACK\nNo callback for the iteration was passed\nFILE_TRANSFER_SERVICES_NOT_SUPPORTED\nThe file transfer services are not supported\nBLOCKED_DUE_TO_ONLINECHANGE\nThe operation is currently not possible because an online\nchange is in progress\nCANCELLED_DUE_TO_ONLINE_CHANGE\nThe operation was cancelled because an online change was\nexecuted between start and end of the operation",
  "tables": [
    {
      "headers": [
        "Name",
        "Comment"
      ],
      "rows": [
        {
          "Name": "NO_ERROR",
          "Comment": ""
        },
        {
          "Name": "TIME_OUT",
          "Comment": ""
        },
        {
          "Name": "NOT_CALLED_FROM_VISU",
          "Comment": ""
        },
        {
          "Name": "NOT_SUPPORTED_FOR_INTEGRATED_VISU",
          "Comment": ""
        },
        {
          "Name": "ERROR",
          "Comment": ""
        },
        {
          "Name": "TRANSFER_CANCELLED",
          "Comment": ""
        },
        {
          "Name": "TRANSER_IN_PROGRESS",
          "Comment": ""
        },
        {
          "Name": "TRANSFER_FAILED",
          "Comment": ""
        },
        {
          "Name": "FILE_READ_ERROR",
          "Comment": ""
        },
        {
          "Name": "VISU_NOT_FOUND",
          "Comment": "No visualization with the given name found."
        },
        {
          "Name": "NO_CLIENT_FILTER",
          "Comment": "No clientFilter (e.g. asFbExecuteSingleVisuActionBase.clientFilter) was set so\nthe action cannot be executed at all."
        },
        {
          "Name": "NO_ITERATION_CALLBACK",
          "Comment": "No callback for the iteration was passed"
        },
        {
          "Name": "FILE_TRANSFER_SERVICES_NOT_SUPPORTED",
          "Comment": "The file transfer services are not supported"
        },
        {
          "Name": "BLOCKED_DUE_TO_ONLINECHANGE",
          "Comment": "The operation is currently not possible because an online\nchange is in progress"
        },
        {
          "Name": "CANCELLED_DUE_TO_ONLINE_CHANGE",
          "Comment": "The operation was cancelled because an online change was\nexecuted between start and end of the operation"
        }
      ]
    }
  ]
}