{
  "library": "CommFB",
  "title": "AINFO_TYPE (Union)",
  "url": "https://content.helpme-codesys.com/en/libs/CommFB/Current/CommFB/AINFO_TYPE.html",
  "page_title": "AINFO_TYPE (UNION)",
  "text": "CommFB\nAINFO_TYPE (Union)\nAddressConcept (GVL)\nAddress Concept\nGenerating a CommFB-ID\nProfibus DP\nProfinet IO\nDevice Diagnosis\nAddress Conversion\nAddresses\nADDR_TO_ID (FunctionBlock)\nADDR_TYPE (Union)\nCREATE_ID (FunctionBlock)\nDP_ADDR (Struct)\nDP_DEVICE_ID (Struct)\nID_TO_ADDR (FunctionBlock)\nIO_SYSTEM_TYPE (Enum)\nPN_ADDR (Struct)\nPN_DEVICE_ID (Struct)\nSUBSLOT_ID (Function)\nCNCT (FunctionBlock)\nConstants (GVL)\nDP Address\nADDR (Function)\nID (Function)\nSLOT_ID (Function)\nDP_AINFO (Struct)\nDP_DIAG (Struct)\nErrorCode (Enum)\nErrorCode1_RW (Enum)\nFieldDevice\nPRVREC (FunctionBlock)\nPRVREC_MODE (Enum)\nRCVREC (FunctionBlock)\nRCVREC_MODE (Enum)\nSALARM (FunctionBlock)\nGETIO_PART (FunctionBlock)\nPN_AINFO (Struct)\nRALARM (FunctionBlock)\nRALARM_MODE (Enum)\nRDIAG (FunctionBlock)\nRDREC (FunctionBlock)\nSETIO_PART (FunctionBlock)\nWRREC (FunctionBlock)\nImages\nLibrary Information\nGetLibVersion (Function)\nGetLibVersionNumber (Function)\nIsLibReleased (Function)\nFile and Project Information\nLibrary Reference\nIoDriver Profibus2 Interfaces\nLibrary Identification\nLibrary Properties\nSysMem\nLibrary Identification\nLibrary Properties\nCommFB\nDocs\n»\nCommFB\n»\nAINFO_TYPE (UNION)\nAINFO_TYPE (UNION)\nÂ¶\nTYPE AINFO_TYPE : UNION\nThis union either contain Profibus or Profinet alarm information, depending on the used IO subsytem type (see:\nRALARM\n).\nInOut:\nName\nType\nComment\nDP\nDP_AINFO\nProfibus alarm information\nPN\nPN_AINFO\nProfinet alarm information",
  "tables": [
    {
      "headers": [
        "Name",
        "Type",
        "Comment"
      ],
      "rows": [
        {
          "Name": "DP",
          "Type": "DP_AINFO",
          "Comment": "Profibus alarm information"
        },
        {
          "Name": "PN",
          "Type": "PN_AINFO",
          "Comment": "Profinet alarm information"
        }
      ]
    }
  ]
}