{
  "library": "CommFB",
  "title": "PN_ADDR (Struct)",
  "url": "https://content.helpme-codesys.com/en/libs/CommFB/Current/CommFB/Addresses/PN_ADDR.html",
  "page_title": "PN_ADDR (STRUCT)",
  "text": "CommFB\nAINFO_TYPE (Union)\nAddressConcept (GVL)\nAddress Concept\nGenerating a CommFB-ID\nProfibus DP\nProfinet IO\nDevice Diagnosis\nAddress Conversion\nAddresses\nADDR_TO_ID (FunctionBlock)\nADDR_TYPE (Union)\nCREATE_ID (FunctionBlock)\nDP_ADDR (Struct)\nDP_DEVICE_ID (Struct)\nID_TO_ADDR (FunctionBlock)\nIO_SYSTEM_TYPE (Enum)\nPN_ADDR (Struct)\nPN_DEVICE_ID (Struct)\nSUBSLOT_ID (Function)\nCNCT (FunctionBlock)\nConstants (GVL)\nDP Address\nADDR (Function)\nID (Function)\nSLOT_ID (Function)\nDP_AINFO (Struct)\nDP_DIAG (Struct)\nErrorCode (Enum)\nErrorCode1_RW (Enum)\nFieldDevice\nPRVREC (FunctionBlock)\nPRVREC_MODE (Enum)\nRCVREC (FunctionBlock)\nRCVREC_MODE (Enum)\nSALARM (FunctionBlock)\nGETIO_PART (FunctionBlock)\nPN_AINFO (Struct)\nRALARM (FunctionBlock)\nRALARM_MODE (Enum)\nRDIAG (FunctionBlock)\nRDREC (FunctionBlock)\nSETIO_PART (FunctionBlock)\nWRREC (FunctionBlock)\nImages\nLibrary Information\nGetLibVersion (Function)\nGetLibVersionNumber (Function)\nIsLibReleased (Function)\nFile and Project Information\nLibrary Reference\nIoDriver Profibus2 Interfaces\nLibrary Identification\nLibrary Properties\nSysMem\nLibrary Identification\nLibrary Properties\nCommFB\nDocs\n»\nCommFB\n»\nAddresses\n»\nPN_ADDR (STRUCT)\nPN_ADDR (STRUCT)\nÂ¶\nTYPE PN_ADDR : STRUCT\ndata structure for physical/native identification or subslot of a PROFINET IO Device.\nInOut:\nName\nType\nInitial\nComment\nVERSION\nBYTE\n1\nVersion of the data structure (1= Version 1)\nMASTER\nBYTE\nD\nPN_DEVICE_ID\nIdentification of the Field Device\nAPI\nDWORD\napplication process identifier\nSLOT\nWORD\nSlot Number (identification of a slot)\nSUBSLOT\nWORD\nSubslot Number (identification of a subslot)",
  "tables": [
    {
      "headers": [
        "Name",
        "Type",
        "Initial",
        "Comment"
      ],
      "rows": [
        {
          "Name": "VERSION",
          "Type": "BYTE",
          "Initial": "1",
          "Comment": "Version of the data structure (1= Version 1)"
        },
        {
          "Name": "MASTER",
          "Type": "BYTE",
          "Initial": "",
          "Comment": ""
        },
        {
          "Name": "D",
          "Type": "PN_DEVICE_ID",
          "Initial": "",
          "Comment": "Identification of the Field Device"
        },
        {
          "Name": "API",
          "Type": "DWORD",
          "Initial": "",
          "Comment": "application process identifier"
        },
        {
          "Name": "SLOT",
          "Type": "WORD",
          "Initial": "",
          "Comment": "Slot Number (identification of a slot)"
        },
        {
          "Name": "SUBSLOT",
          "Type": "WORD",
          "Initial": "",
          "Comment": "Subslot Number (identification of a subslot)"
        }
      ]
    }
  ]
}