{
  "library": "CommFB",
  "title": "PN_AINFO (Struct)",
  "url": "https://content.helpme-codesys.com/en/libs/CommFB/Current/CommFB/PN_AINFO.html",
  "page_title": "PN_AINFO (STRUCT)",
  "text": "CommFB\nAINFO_TYPE (Union)\nAddressConcept (GVL)\nAddress Concept\nGenerating a CommFB-ID\nProfibus DP\nProfinet IO\nDevice Diagnosis\nAddress Conversion\nAddresses\nADDR_TO_ID (FunctionBlock)\nADDR_TYPE (Union)\nCREATE_ID (FunctionBlock)\nDP_ADDR (Struct)\nDP_DEVICE_ID (Struct)\nID_TO_ADDR (FunctionBlock)\nIO_SYSTEM_TYPE (Enum)\nPN_ADDR (Struct)\nPN_DEVICE_ID (Struct)\nSUBSLOT_ID (Function)\nCNCT (FunctionBlock)\nConstants (GVL)\nDP Address\nADDR (Function)\nID (Function)\nSLOT_ID (Function)\nDP_AINFO (Struct)\nDP_DIAG (Struct)\nErrorCode (Enum)\nErrorCode1_RW (Enum)\nFieldDevice\nPRVREC (FunctionBlock)\nPRVREC_MODE (Enum)\nRCVREC (FunctionBlock)\nRCVREC_MODE (Enum)\nSALARM (FunctionBlock)\nGETIO_PART (FunctionBlock)\nPN_AINFO (Struct)\nRALARM (FunctionBlock)\nRALARM_MODE (Enum)\nRDIAG (FunctionBlock)\nRDREC (FunctionBlock)\nSETIO_PART (FunctionBlock)\nWRREC (FunctionBlock)\nImages\nLibrary Information\nGetLibVersion (Function)\nGetLibVersionNumber (Function)\nIsLibReleased (Function)\nFile and Project Information\nLibrary Reference\nIoDriver Profibus2 Interfaces\nLibrary Identification\nLibrary Properties\nSysMem\nLibrary Identification\nLibrary Properties\nCommFB\nDocs\n»\nCommFB\n»\nPN_AINFO (STRUCT)\nPN_AINFO (STRUCT)\nÂ¶\nTYPE PN_AINFO : STRUCT\nAlarm information of a profinet device (see:\nRALARM\n).\n(see IEC 61158-6)\nInOut:\nName\nType\nComment\nBlockType\nUINT\nBlockType\nBlockLength\nUINT\nLength (in bytes) of field AlarmData\nVersion\nUINT\nversion high + low\nAlarmType\nUINT\nAlarm type\nAPI\nUDINT\nApplication Process Identifier\nSlot\nUINT\nSlot number\nSubslot\nUINT\nSubslot number\nModuleIdentNumber\nUDINT\nModule Identification number\nSubmoduleIdentNumber\nUDINT\nSubmodule Identification number\nAlarmSpecifier\nUINT\nAlarm Specifier\nBit 0 to 10: SequenceNumber\nBit 11: ChannelDiagnosis\nBit 12: ManufacturerSpecificDiagnosis\nBit 13: SubmoduleDiagnosisState\nBit 14: not used\nBit 15: ARDiagnosisState\nUSI\nUINT\nUserStructure Identifier\nAlarmData\nARRAY\n[0..(Constants.MAX_PN_ALARM_DATA\n- 1)] OF BYTE\nAlarm information (0..n) bytes)",
  "tables": [
    {
      "headers": [
        "Name",
        "Type",
        "Comment"
      ],
      "rows": [
        {
          "Name": "BlockType",
          "Type": "UINT",
          "Comment": "BlockType"
        },
        {
          "Name": "BlockLength",
          "Type": "UINT",
          "Comment": "Length (in bytes) of field AlarmData"
        },
        {
          "Name": "Version",
          "Type": "UINT",
          "Comment": "version high + low"
        },
        {
          "Name": "AlarmType",
          "Type": "UINT",
          "Comment": "Alarm type"
        },
        {
          "Name": "API",
          "Type": "UDINT",
          "Comment": "Application Process Identifier"
        },
        {
          "Name": "Slot",
          "Type": "UINT",
          "Comment": "Slot number"
        },
        {
          "Name": "Subslot",
          "Type": "UINT",
          "Comment": "Subslot number"
        },
        {
          "Name": "ModuleIdentNumber",
          "Type": "UDINT",
          "Comment": "Module Identification number"
        },
        {
          "Name": "SubmoduleIdentNumber",
          "Type": "UDINT",
          "Comment": "Submodule Identification number"
        },
        {
          "Name": "AlarmSpecifier",
          "Type": "UINT",
          "Comment": "Alarm SpecifierBit 0 to 10: SequenceNumberBit 11: ChannelDiagnosisBit 12: ManufacturerSpecificDiagnosisBit 13: SubmoduleDiagnosisStateBit 14: not usedBit 15: ARDiagnosisState"
        },
        {
          "Name": "USI",
          "Type": "UINT",
          "Comment": "UserStructure Identifier"
        },
        {
          "Name": "AlarmData",
          "Type": "ARRAY\n[0..(Constants.MAX_PN_ALARM_DATA\n- 1)] OF BYTE",
          "Comment": "Alarm information (0..n) bytes)"
        }
      ]
    }
  ]
}