{
  "library": "CommFB",
  "title": "PRVREC_MODE (Enum)",
  "url": "https://content.helpme-codesys.com/en/libs/CommFB/Current/CommFB/FieldDevice/PRVREC_MODE.html",
  "page_title": "PRVREC_MODE (ENUM)",
  "text": "CommFB\nAINFO_TYPE (Union)\nAddressConcept (GVL)\nAddress Concept\nGenerating a CommFB-ID\nProfibus DP\nProfinet IO\nDevice Diagnosis\nAddress Conversion\nAddresses\nADDR_TO_ID (FunctionBlock)\nADDR_TYPE (Union)\nCREATE_ID (FunctionBlock)\nDP_ADDR (Struct)\nDP_DEVICE_ID (Struct)\nID_TO_ADDR (FunctionBlock)\nIO_SYSTEM_TYPE (Enum)\nPN_ADDR (Struct)\nPN_DEVICE_ID (Struct)\nSUBSLOT_ID (Function)\nCNCT (FunctionBlock)\nConstants (GVL)\nDP Address\nADDR (Function)\nID (Function)\nSLOT_ID (Function)\nDP_AINFO (Struct)\nDP_DIAG (Struct)\nErrorCode (Enum)\nErrorCode1_RW (Enum)\nFieldDevice\nPRVREC (FunctionBlock)\nPRVREC_MODE (Enum)\nRCVREC (FunctionBlock)\nRCVREC_MODE (Enum)\nSALARM (FunctionBlock)\nGETIO_PART (FunctionBlock)\nPN_AINFO (Struct)\nRALARM (FunctionBlock)\nRALARM_MODE (Enum)\nRDIAG (FunctionBlock)\nRDREC (FunctionBlock)\nSETIO_PART (FunctionBlock)\nWRREC (FunctionBlock)\nImages\nLibrary Information\nGetLibVersion (Function)\nGetLibVersionNumber (Function)\nIsLibReleased (Function)\nFile and Project Information\nLibrary Reference\nIoDriver Profibus2 Interfaces\nLibrary Identification\nLibrary Properties\nSysMem\nLibrary Identification\nLibrary Properties\nCommFB\nDocs\n»\nCommFB\n»\nFieldDevice\n»\nPRVREC_MODE (ENUM)\nPRVREC_MODE (ENUM)\nÂ¶\nTYPE PRVREC_MODE :\nAttributes:\nqualified_only\nInOut:\nName\nInitial\nComment\nCHECK\n0\nIf the Field Device interface has received a request to provide a process data record, only the outputs NEW, SLOT, INDEX and RLEN are set.\nMultiple calls of this function block with MODE=0 returns the outputs for the same request.\nRECEIVE\n1\nIf the Field Device interface has received a request, the\nfunction block outputs are updated.\nRECEIVE_BY_SLOT\n2\nIf the Field Device interface has received a request for the\nslot and subslot the numbers of which are given in F_ID\ninput, the function block outputs are updated.\nPOS_RESPONSE\n3\nAfter checking or receiving the request to provide a process data record, this function block provides the requested process data record with its\nRECORD parameter and sends a positive response to the Host Controller.\nNEG_RESPONSE\n4\nAfter checking or receiving the request to provide a process data record, this function block refuses to provide this record and sends a negative response to the Host Controller.\nThe error reason is given with the inputs CODE1 and CODE2.",
  "tables": [
    {
      "headers": [
        "Name",
        "Initial",
        "Comment"
      ],
      "rows": [
        {
          "Name": "CHECK",
          "Initial": "0",
          "Comment": "If the Field Device interface has received a request to provide a process data record, only the outputs NEW, SLOT, INDEX and RLEN are set.\nMultiple calls of this function block with MODE=0 returns the outputs for the same request."
        },
        {
          "Name": "RECEIVE",
          "Initial": "1",
          "Comment": "If the Field Device interface has received a request, the\nfunction block outputs are updated."
        },
        {
          "Name": "RECEIVE_BY_SLOT",
          "Initial": "2",
          "Comment": "If the Field Device interface has received a request for the\nslot and subslot the numbers of which are given in F_ID\ninput, the function block outputs are updated."
        },
        {
          "Name": "POS_RESPONSE",
          "Initial": "3",
          "Comment": "After checking or receiving the request to provide a process data record, this function block provides the requested process data record with its\nRECORD parameter and sends a positive response to the Host Controller."
        },
        {
          "Name": "NEG_RESPONSE",
          "Initial": "4",
          "Comment": "After checking or receiving the request to provide a process data record, this function block refuses to provide this record and sends a negative response to the Host Controller.\nThe error reason is given with the inputs CODE1 and CODE2."
        }
      ]
    }
  ]
}