{
  "library": "Standard",
  "title": "RTC (FunctionBlock)",
  "url": "https://content.helpme-codesys.com/en/libs/Standard/Current/Miscellaneous/RTC.html",
  "page_title": "RTC (FB)",
  "text": "Deutsch\nEnglish\nFrançais\nEspañol\nItaliano\nРусский\n日本語\n中文\nMenu\nSearch\nDeutsch\nEnglish\nFrançais\nEspañol\nItaliano\nРусский\n日本語\n中文\nBistable Function Blocks\nRS (FunctionBlock)\nSR (FunctionBlock)\nCounter\nCTD (FunctionBlock)\nCTU (FunctionBlock)\nCTUD (FunctionBlock)\nMiscellaneous\nRTC (FunctionBlock)\nString Functions\nCONCAT (Function)\nDELETE (Function)\nFIND (Function)\nINSERT (Function)\nLEFT (Function)\nLEN (Function)\nMID (Function)\nREPLACE (Function)\nRIGHT (Function)\nTimer\nTOF (FunctionBlock)\nTON (FunctionBlock)\nTP (FunctionBlock)\nTrigger\nF_TRIG (FunctionBlock)\nR_TRIG (FunctionBlock)\nFile and Project Information\nLibrary Reference\nStandard\nDocs\n»\nMiscellaneous\n»\nRTC (FB)\nRTC (FB)\nÂ¶\nFUNCTION_BLOCK RTC\nCalculates the elapsed time since a given start time\nUsage Examples:\nThis function block can be used as an operation hour counter, when\nPDT\nis set to\nDT#1970-01-01-00-00:00\n, or is simply not connected.\nThis function block can be used to return the current date and time,\nby adjusting the FB to the current local time. Just, set the input\nPDT\nto the current local time, on the rising edge of\nEN\n.\nNote\nThis counter will have an overflow at the 7th February, 2106.\n(* Example in ST *)\nRTC\n(\nEN\n:=\nVarBOOL1\n,\nPDT\n:=\nDT#2006-03-30-14:00:00\n,\nQ\n=>\nVarBOOL2\n,\nCDT\n=>\nVarTimeCur\n);\nInOut:\nScope\nName\nType\nComment\nInput\nEN\nBOOL\nRising edge:\nCDT\nis set to\nPDT\nand\nCDT\nstarts increasing.\nFalling edge:\nCDT\nis set to\nDT#1970-01-01-00:00:00\n.\nPDT\nDT\nPreset date and time\nOutput\nQ\nBOOL\nTRUE\nas long as\nCDT\nis counting\nCDT\nDT\nDate and time, elapsed since\nPDT\ntop\nCODESYS Group | We\nsoftware\nAutomation.\nto software\n['sɒftwɛər]\ntransitive verb\n__softwared/softwaring\n: to develop software\n// to software automation: to develop software for automation purposes\nThe CODESYS Group is the manufacturer of CODESYS, the leading hardware-independent\n                                    IEC 61131-3 automation software for developing and engineering controller\n                                    applications.\nCODESYS® is a registered trademark.\nCODESYS GmbH\nA member of the CODESYS Group\nMemminger Straße 151, 87439 Kempten\nGermany\nTel.:\n+49-831-54031-0\ninfo@codesys.com\nLegal Notice\nPrivacy Policy\nLinkedIn\nYoutube\nRSS\nDownloads\nLogin\nCODESYS Store\n© 2022 CODESYS GmbH\n| A member of the CODESYS Group",
  "tables": [
    {
      "headers": [
        "Scope",
        "Name",
        "Type",
        "Comment"
      ],
      "rows": [
        {
          "Scope": "Input",
          "Name": "EN",
          "Type": "BOOL",
          "Comment": "Rising edge:CDTis set toPDTandCDTstarts increasing.Falling edge:CDTis set toDT#1970-01-01-00:00:00."
        },
        [
          "PDT",
          "DT",
          "Preset date and time"
        ],
        {
          "Scope": "Output",
          "Name": "Q",
          "Type": "BOOL",
          "Comment": "TRUEas long asCDTis counting"
        },
        [
          "CDT",
          "DT",
          "Date and time, elapsed sincePDT"
        ]
      ]
    }
  ]
}