{
  "library": "String Segments",
  "title": "Reset (Function)",
  "url": "https://content.helpme-codesys.com/en/libs/String Segments/Current/Strings/Functions/Reset.html",
  "page_title": "Reset (FUN)",
  "text": "Library Information\nGetLibVersion (Function)\nGetLibVersionNumber (Function)\nIsLibReleased (Function)\nStrings\nAliases\nConstants (GVL)\nIDisposable (Alias)\nRUNE (Alias)\nEnums\nERROR (Enum)\nFunctionblocks\nRange (FunctionBlock)\nIRange\nSetInitialValue (Method)\nUTF8Literal (FunctionBlock)\nSetInitialValue (Method)\n_RangePool (FunctionBlock)\nProtected\n_StringPool (FunctionBlock)\nIStringPool\nSetInitialValue (Method)\n_UTF8String (FunctionBlock)\nIString\nIStringRepresentation\nFunctions\nCompare (Function)\nCopy (Function)\nCreateRangePool (Function)\nCreateString (Function)\nCreateStringPool (Function)\nIsASCIIString (Function)\nIsValidString (Function)\nLen (Function)\nReset (Function)\nRuneCount (Function)\nSetSegment (Function)\nInterfaces\nIRange (Interface)\nGetNextRune (Method)\nReset (Method)\nUngetLastRune (Method)\nIRangePool (Interface)\nGetPoolStatus (Method)\nGetRange (Method)\nIRangeProvider (Interface)\nGetRange (Method)\nIString (Interface)\nGetSegment (Method)\nIsASCII (Method)\nIsValid (Method)\nLen (Method)\nIStringPool (Interface)\nGetPoolConfig (Method)\nGetString (Method)\nIStringRepresentation (Interface)\nLen (Method)\nToIString (Method)\nStructs\nCONFIG (Struct)\nSTATUS (Struct)\nFile and Project Information\nLibrary Reference\nMemory Block Manager\nLibrary Identification\nLibrary Properties\nSysMem\nLibrary Identification\nLibrary Properties\nUTF-8 Encoding Support\nLibrary Identification\nLibrary Properties\nString Segments\nDocs\n»\nStrings\n»\nFunctions\n»\nReset (FUN)\nReset (FUN)\nÂ¶\nFUNCTION Reset :\nERROR\nSet back the empty state of this\nIString\ninstance\nInOut:\nScope\nName\nType\nReturn\nReset\nERROR\nInput\nitfString\nIString",
  "tables": [
    {
      "headers": [
        "Scope",
        "Name",
        "Type"
      ],
      "rows": [
        {
          "Scope": "Return",
          "Name": "Reset",
          "Type": "ERROR"
        },
        {
          "Scope": "Input",
          "Name": "itfString",
          "Type": "IString"
        }
      ]
    }
  ]
}