{
  "library": "SysFile",
  "title": "ACCESS_MODE (Enum)",
  "url": "https://content.helpme-codesys.com/en/libs/SysFile/Current/ACCESS_MODE.html",
  "page_title": "ACCESS_MODE (ENUM)",
  "text": "Deutsch\nEnglish\nFrançais\nEspañol\nItaliano\nРусский\n日本語\n中文\nMenu\nSearch\nDeutsch\nEnglish\nFrançais\nEspañol\nItaliano\nРусский\n日本語\n中文\nACCESS_MODE (Enum)\nSYS_FILETIME (Struct)\nSYS_FILE_STATUS (Enum)\nSysFileClose (Function)\nSysFileCopy (Function)\nSysFileDelete (Function)\nSysFileDeleteByHandle (Function)\nSysFileEOF (Function)\nSysFileFlush (Function)\nSysFileGetName (Function)\nSysFileGetName2 (Function)\nSysFileGetPath (Function)\nSysFileGetPos (Function)\nSysFileGetSize (Function)\nSysFileGetSizeByHandle (Function)\nSysFileGetStatus (Function)\nSysFileGetStatus2 (Function)\nSysFileGetTime (Function)\nSysFileOpen (Function)\nSysFileRead (Function)\nSysFileRename (Function)\nSysFileSetPos (Function)\nSysFileTruncate (Function)\nSysFileWrite (Function)\nFile and Project Information\nLibrary Reference\nSysTypes2 Interfaces\nLibrary Identification\nLibrary Properties\nSysFile\nDocs\n»\nACCESS_MODE (ENUM)\nACCESS_MODE (ENUM)\nÂ¶\nTYPE ACCESS_MODE :\nAccess mode\nFile modes to open a file.\nNote\nFor all\n*_PLUS\nmodes be aware, that after reading from a file, writing can only be done after a call\nto\nSysFileGetPos\nor\nSysFileSetPos\n! If you call\nSysFileWrite\nright after\nSysFileRead\n,\nthe file pointer could be on an invalid position!\nCorrect example:\nSysFileRead\n();\nSysFileGetPos\n();\nSysFileWrite\n();\nInOut:\nName\nComment\nAM_READ\nOpen an existing file with Read access. If file does not\nexist, Open fails\nAM_WRITE\nCreate new file with Write access. If file does exist,\ncontent is discarded\nAM_APPEND\nOpen an existing file with Append (only write) access. If\nfile does not exist, Open fails\nAM_READ_PLUS\nOpen an existing file with Read/Write access. If file does\nnot exist, Open fails\nAM_WRITE_PLUS\nCreate new file with Read/Write access. If file does exist,\ncontent is discarded\nAM_APPEND_PLUS\nOpen an existing file with Append (read/write) access. If\nfile does not exist, Open creates a new file\ntop\nCODESYS Group | We\nsoftware\nAutomation.\nto software\n['sɒftwɛər]\ntransitive verb\n__softwared/softwaring\n: to develop software\n// to software automation: to develop software for automation purposes\nThe CODESYS Group is the manufacturer of CODESYS, the leading hardware-independent\n                                    IEC 61131-3 automation software for developing and engineering controller\n                                    applications.\nCODESYS® is a registered trademark.\nCODESYS GmbH\nA member of the CODESYS Group\nMemminger Straße 151, 87439 Kempten\nGermany\nTel.:\n+49-831-54031-0\ninfo@codesys.com\nLegal Notice\nPrivacy Policy\nLinkedIn\nYoutube\nRSS\nDownloads\nLogin\nCODESYS Store\n© 2022 CODESYS GmbH\n| A member of the CODESYS Group",
  "tables": [
    {
      "headers": [
        "Name",
        "Comment"
      ],
      "rows": [
        {
          "Name": "AM_READ",
          "Comment": "Open an existing file with Read access. If file does not\nexist, Open fails"
        },
        {
          "Name": "AM_WRITE",
          "Comment": "Create new file with Write access. If file does exist,\ncontent is discarded"
        },
        {
          "Name": "AM_APPEND",
          "Comment": "Open an existing file with Append (only write) access. If\nfile does not exist, Open fails"
        },
        {
          "Name": "AM_READ_PLUS",
          "Comment": "Open an existing file with Read/Write access. If file does\nnot exist, Open fails"
        },
        {
          "Name": "AM_WRITE_PLUS",
          "Comment": "Create new file with Read/Write access. If file does exist,\ncontent is discarded"
        },
        {
          "Name": "AM_APPEND_PLUS",
          "Comment": "Open an existing file with Append (read/write) access. If\nfile does not exist, Open creates a new file"
        }
      ]
    }
  ]
}