{
  "library": "CmpBACnet",
  "title": "BACnetCreateObjectResult (Struct)",
  "url": "https://content.helpme-codesys.com/en/libs/CmpBACnet/Current/BACnetClientAPI/BACnetCreateObjectResult.html",
  "page_title": "BACnetCreateObjectResult (STRUCT)",
  "text": "Deutsch\nEnglish\nFrançais\nEspañol\nItaliano\nРусский\n日本語\n中文\nMenu\nSearch\nDeutsch\nEnglish\nFrançais\nEspañol\nItaliano\nРусский\n日本語\n中文\nBACnetAsyncTransactionToken (Struct)\nBACnetClientAPI\nBACnetAcknowledgeAlarm (Function)\nBACnetAddListElement (Function)\nBACnetCancelPendingConfirmedRequest (Function)\nBACnetConfPrivateTransfer (Function)\nBACnetConfTextMessage (Function)\nBACnetCreateObject (Function)\nBACnetCreateObjectResult (Struct)\nBACnetDeleteObject (Function)\nBACnetDeviceCommControl (Function)\nBACnetGetAlarmSummary (Function)\nBACnetGetEnrollmentSummary (Function)\nBACnetGetEventInfo (Function)\nBACnetLifeSafetyOperation (Function)\nBACnetReadAllPropertyDataContents (Function)\nBACnetReadFile (Function)\nBACnetReadProperty (Function)\nBACnetReadPropertyMultiple (Function)\nBACnetReadRange (Function)\nBACnetReinitializeDevice (Function)\nBACnetRemoveListElement (Function)\nBACnetSubscribeCOV (Function)\nBACnetSubscribeCOVProperty (Function)\nBACnetUnconfPrivateTransfer (Function)\nBACnetUnconfTextMessage (Function)\nBACnetWhoHas (Function)\nBACnetWhoIs (Function)\nBACnetWriteFile (Function)\nBACnetWriteGroup (Function)\nBACnetWriteProperty (Function)\nBACnetWritePropertyMultiple (Function)\nadvanced\nBACnetBackupBACnetDevice (Function)\nBACnetCloseClientCustomer (Function)\nBACnetGetClientDeviceCommunication (Function)\nBACnetOpenClientCustomer (Function)\nBACnetRegisterClientCommunicationStateCallback (Function)\nBACnetRegisterClientDataPoint (Function)\nBACnetRegisterClientEventNotification (Function)\nBACnetRegisterClientUnsubscribeCompletionCallback (Function)\nBACnetRestartAllClients (Function)\nBACnetRestoreBACnetDevice (Function)\nBACnetSetClientDeviceCommunication (Function)\nBACnetSetClientDeviceFixAddress (Function)\nBACnetSetClientDeviceFixSubscribeCovTime (Function)\nBACnetSetClientGlobalCommTimingParameters (Function)\nBACnetSetClientGlobalMaxDeviceActions (Function)\nBACnetUnregisterClientDataPoint (Function)\nBACnetUnregisterClientEventNotification (Function)\nFile and Project Information\nLibrary Reference\n3SLicense\nLibrary Identification\nLibrary Properties\nCAA Ressource Manager Extern\nLibrary Identification\nLibrary Properties\nCAA Types Extern\nLibrary Identification\nLibrary Properties\nCmpErrors2 Interfaces\nLibrary Identification\nLibrary Properties\nCmpEventMgr\nLibrary Identification\nLibrary Properties\nCmpLog\nLibrary Identification\nLibrary Properties\nCmpSettings\nLibrary Identification\nLibrary Properties\nComponent Manager\nLibrary Identification\nLibrary Properties\nIoStandard\nLibrary Identification\nLibrary Properties\nStandard\nLibrary Identification\nLibrary Properties\nSysMem\nLibrary Identification\nLibrary Properties\nSysTarget\nLibrary Identification\nLibrary Properties\nSysTask\nLibrary Identification\nLibrary Properties\nSysTypes2 Interfaces\nLibrary Identification\nLibrary Properties\nCmpBACnet\nDocs\n»\nBACnetClientAPI\n»\nBACnetCreateObjectResult (STRUCT)\nBACnetCreateObjectResult (STRUCT)\nÂ¶\nTYPE BACnetCreateObjectResult : STRUCT\nA data transport unit for results of\nBACnetCreateObject\n.\nBACnetCreateObjectResult transports a pointers to an object-ID and the âfirst failedâ sequence number.\nThe caller had to provide the memory pointed to by those pointers.\nInOut:\nName\nType\nComment\npObjectID\nPOINTER TO\nIEC_BACNET_OBJECT_ID\nA pointer to the memory block to return the object Identifier of a newly created\nobject if successfully creating of the object, and successfully initializing all\nthe properties specified.\npFirstFailed\nPOINTER TO\nIEC_BACNET_UNSIGNED\nA pointer to the memory block to transport the numerical position, started at 1, of\nthe offending property value which was successfully written. If the present request\nis considered invalid for reasons other than property initialization or the present\nrequest is valid, this argument shall have a value of zero.\ntop\nCODESYS Group | We\nsoftware\nAutomation.\nto software\n['sɒftwɛər]\ntransitive verb\n__softwared/softwaring\n: to develop software\n// to software automation: to develop software for automation purposes\nThe CODESYS Group is the manufacturer of CODESYS, the leading hardware-independent\n                                    IEC 61131-3 automation software for developing and engineering controller\n                                    applications.\nCODESYS® is a registered trademark.\nCODESYS GmbH\nA member of the CODESYS Group\nMemminger Straße 151, 87439 Kempten\nGermany\nTel.:\n+49-831-54031-0\ninfo@codesys.com\nLegal Notice\nPrivacy Policy\nLinkedIn\nYoutube\nRSS\nDownloads\nLogin\nCODESYS Store\n© 2022 CODESYS GmbH\n| A member of the CODESYS Group",
  "tables": [
    {
      "headers": [
        "Name",
        "Type",
        "Comment"
      ],
      "rows": [
        {
          "Name": "pObjectID",
          "Type": "POINTER TOIEC_BACNET_OBJECT_ID",
          "Comment": "A pointer to the memory block to return the object Identifier of a newly created\nobject if successfully creating of the object, and successfully initializing all\nthe properties specified."
        },
        {
          "Name": "pFirstFailed",
          "Type": "POINTER TOIEC_BACNET_UNSIGNED",
          "Comment": "A pointer to the memory block to transport the numerical position, started at 1, of\nthe offending property value which was successfully written. If the present request\nis considered invalid for reasons other than property initialization or the present\nrequest is valid, this argument shall have a value of zero."
        }
      ]
    }
  ]
}